,Article Titles,Date
881,"U.S. activist investors Land & Buildings, Engaged raise new capital: sources"," - Mar 24, 2020"
882,Dow soars over 11% in strongest one-day performance since 1933," - Mar 24, 2020"
883,U.S. stocks higher at close of trade; Dow Jones Industrial Average up 11.37%," - Mar 24, 2020"
884,"Nike Earnings, Revenue Beat in Q3 Despite Covid-19 Impact"," - Mar 24, 2020"
885,Stocks - Dow Racks up Biggest Point Gain Ever on Fiscal Rescue Deal Optimism," - Mar 24, 2020"
886,Stocks - Europe Slides as Govt Packages Bring Only Temporary Relief," - Mar 18, 2020"
887,Asian Stocks Mixed as Volatility Continues ," - Mar 17, 2020"
888,Day Ahead: Top 3 Things to Watch for March 18," - Mar 17, 2020"
889,U.S. stocks higher at close of trade; Dow Jones Industrial Average up 5.20%," - Mar 17, 2020"
890,Wall Street gives thumbs down to potential shortened trading day," - Mar 17, 2020"
891,"FedEx Beats Earnings in Q3, but Pulls Guidance on Covid-19 Uncertainty"," - Mar 17, 2020"
892,"Stocks - Dow Notches 1,000-Point Gain; Trump Eyes $1T Stimulus"," - Mar 17, 2020"
893,'A Twilight Zone': U.S. takes shelter against coronavirus as Trump seeks economic stimulus," - Mar 17, 2020"
894,Stocks - Wall Street Rides Wave of Stimulus to Near Session Highs," - Mar 17, 2020"
895,"Oil Stays Under $30 Despite Checks, Tax Deferral Planned for Americans"," - Mar 17, 2020"
896,U.S. reels as coronavirus outbreak leads to widespread disruptions," - Mar 12, 2020"
897,"As markets sink, some traders bet Fed rate goes negative in 2020"," - Mar 12, 2020"
898,Stocks - Dow's Worst Loss Since '87 Crash; Fed Bazooka Fails to Halt Bears," - Mar 12, 2020"
899,"Oracle Earnings, Revenue Beat in Q3"," - Mar 12, 2020"
900,"After Saudi-Russian Drama, Trump’s Europe Ban Delivers Fresh Pain to Oil"," - Mar 12, 2020"
901,Democratic presidential hopeful Biden attacks Trump's coronavirus response," - Mar 12, 2020"
902,Stocks - Bears Resume Grip on Dow as Fed-Stimulus Optimism Runs out of Steam," - Mar 12, 2020"
903,Oil Selloff Eases as Wall Street Pares Some Losses on Fed Injection," - Mar 12, 2020"
904,Markets in virus panic: day's plunge in charts," - Mar 12, 2020"
905,Stocks – Wall Street Cuts Losses Sharply on Huge Fed Cash Influx," - Mar 12, 2020"
906,"Bloody Monday: Bitcoin Price Loses $8K, Oil -30%, DOW Futures Plunge"," - Mar 09, 2020"
907,Oil Collapse Sparks Lowest Bond Yields in History: Markets Wrap," - Mar 09, 2020"
908,"World stocks sink on coronavirus shock, oil price crash"," - Mar 09, 2020"
909,"Aramco trades below IPO price for first time, after OPEC pact unravels"," - Mar 08, 2020"
910,3 Things Under the Radar This Week," - Mar 07, 2020"
911,U.S. stocks lower at close of trade; Dow Jones Industrial Average down 0.98%," - Mar 06, 2020"
912,U.S. pumps $8.3 billion into coronavirus battle as more states report cases," - Mar 06, 2020"
913,"Stocks – Wall Street Falls Again, but Late Buying Limits the Damage"," - Mar 06, 2020"
914,"Stocks Deep in Red, Set for Another Wild End to Trading"," - Mar 06, 2020"
915,Volatility-Weary Wall Street Sinks Again," - Mar 06, 2020"
916,"Wall Street Weekahead: Main Street leans toward Sanders, but Wall Street says Trump"," - Feb 28, 2020"
917,"Wall Street in coronavirus contingency mode with staff, visitors, regulators"," - Feb 28, 2020"
918,"S&P falls for seventh day, suffers biggest weekly plunge since 2008 crisis"," - Feb 28, 2020"
919,U.S. stocks mixed at close of trade; Dow Jones Industrial Average down 1.39%," - Feb 28, 2020"
920,Central banks may mount a coronavirus rescue. It may not be enough," - Feb 28, 2020"
921,Stocks - Wall Street Falls Again in Worst Weekly Loss Since ’08," - Feb 28, 2020"
922,Think the S&P 500 is in bad shape? Its components look worse," - Feb 28, 2020"
923,Investor pessimism rising but may not be bearish enough," - Feb 28, 2020"
924,Oil Back Under $50 in Worst Week Since the Great Recession," - Feb 28, 2020"
925,Stocks - Wall Street Trims Losses as Powell Boosts Hopes of Fed Rescue," - Feb 28, 2020"
926,Stocks - U.S. Futures Regain Ground after Briefly Turning Negative," - Feb 25, 2020"
927,"Top 5 Things to Know in the Market on Tuesday, February 25th"," - Feb 25, 2020"
928,"Asia share slide pauses, awaiting clarity on pandemic risk"," - Feb 24, 2020"
929,Wall Street plunges on fears of coronavirus pandemic," - Feb 24, 2020"
930,U.S. stocks lower at close of trade; Dow Jones Industrial Average down 3.56%," - Feb 24, 2020"
931,U.S. stocks lower at close of trade; Dow Jones Industrial Average down 3.56%," - Feb 24, 2020"
932,"Health insurer shares pummeled by Sanders surge, virus worries"," - Feb 24, 2020"
933,"Stocks - Dow, S&P Suffer Biggest One-Day Loss in Two Years on Virus Fear Selling"," - Feb 24, 2020"
934,"Investors eye bleach, food and tissues as virus fears intensify"," - Feb 24, 2020"
935,Stocks - Dow Turns Negative for 2020 on Virus Threat to Growth," - Feb 24, 2020"
936,Stocks - S&P Ends off Lows in Wild Ride as WHO Calms Virus Jitters," - Feb 13, 2020"
937,Stocks - Wall Street Bounces From Lows Despite Fresh Coronavirus Worries," - Feb 13, 2020"
938,Breaking: White House Doubts China Virus Information – Reports," - Feb 13, 2020"
939,Stocks - Wall Street Tumbles in Early Trade as Virus Fears Revive," - Feb 13, 2020"
940,U.S. Stocks Hit by Renewed Coronavirus Jitters: Markets Wrap," - Feb 13, 2020"
941,Stocks - US Futures Lower; Sentiment Slips as Virus Cases Soar," - Feb 13, 2020"
942,"Top 5 Things to Know in the Market on Thursday, February 13th"," - Feb 13, 2020"
943,U.S. stocks higher at close of trade; Dow Jones Industrial Average up 0.94%," - Feb 12, 2020"
944,Wall Street sets record closing highs as coronavirus fears subside," - Feb 12, 2020"
945,Stocks - Wall Street's Record Run Continues as Virus Fears Cool," - Feb 12, 2020"
946,Stocks - S&P Continues to Flirt With Record as Energy Stocks Jump," - Feb 05, 2020"
947,"Stocks - Wall Street Opens Strongly Again, but Ford, Snap Tumble"," - Feb 05, 2020"
948,Ford shares fall 8% after disappointing 2020 profit outlook," - Feb 05, 2020"
949,Stocks - U.S. Futures Jump on Virus Hopes; GM in Focus After Ford Slump," - Feb 05, 2020"
950,"Trump touts stock market's record run, but who benefits?"," - Feb 05, 2020"
951,U.S. stocks higher at close of trade; Dow Jones Industrial Average up 1.44%," - Feb 04, 2020"
952,Disney Tops Q1 Results as Disney+ Shines," - Feb 04, 2020"
953,"Microchip Earnings, Revenue Beat in Q3"," - Feb 04, 2020"
954,"KLA-Tencor Earnings, Revenue Beat in Q2"," - Feb 04, 2020"
955,"Chubb Earnings, Revenue Beat in Q4"," - Feb 04, 2020"
956,U.S. stocks mixed at close of trade; Dow Jones Industrial Average up 0.04%," - Jan 29, 2020"
957,Stocks lose steam in wake of Fed statement," - Jan 29, 2020"
958,"Stocks - S&P Slips as Virus Fears Persist, Fed Stands Pat on Rates"," - Jan 29, 2020"
959,"Mondelez Earnings, Revenue Beat in Q4"," - Jan 29, 2020"
960,"Illumina Earnings, Revenue Beat in Q4"," - Jan 29, 2020"
961,Stocks - S&P off Highs on Wuhan Virus Jitters; Apple Hits Record High," - Jan 29, 2020"
962,Apple's iPhone strength is back and analysts say it is here to stay," - Jan 29, 2020"
963,McDonald's sees 2020 spending on tech after sales beat; breakfast competition looms," - Jan 29, 2020"
964,"Mastercard Earnings, Revenue Beat in Q4"," - Jan 29, 2020"
965,"Buoyed by company earnings, world markets look past virus"," - Jan 29, 2020"
966,Stocks - S&P Pares Gains as China's New Virus Spreads," - Jan 22, 2020"
967,Stocks - S&P Continues Flirt With Record as Tech Rallies," - Jan 22, 2020"
968,AT&T’s ‘Unique Scale’ Bumps Stock Up," - Jan 22, 2020"
969,Investors look for insurance as U.S. bull market runs: BNP fund manager," - Jan 22, 2020"
970,Stocks - Europe Seen Higher; Virus Fears Retreat," - Jan 22, 2020"
971,U.S. stocks lower at close of trade; Dow Jones Industrial Average down 0.52%," - Jan 21, 2020"
972,Wall St. pulls back from records on worries about virus outbreak and global growth," - Jan 21, 2020"
973,Stocks - S&P Falls as U.S Coronavirus Scare Sours Sentiment," - Jan 21, 2020"
974,Stocks - S&P Turns Positive as Tech Fashions Rebound," - Jan 21, 2020"
975,Stocks - Wall Street Opens Lower on Virus Fears; Airlines Hit," - Jan 21, 2020"
976,"Stocks - Dow Reverses Course, Loses 130 After Hitting 29,000"," - Jan 10, 2020"
977,"Wall Streets trades near record high, brushes off weak jobs data"," - Jan 10, 2020"
978,"Stocks Edge Higher, Bonds Rise After Jobs Data; Dow Tops 29K"," - Jan 10, 2020"
979,Goldilocks Pays a Visit Via the Payrolls Report," - Jan 10, 2020"
980,Stocks - Subdued Start on Wall Street After Payrolls," - Jan 10, 2020"
981,"As U.S. election heats up, investors brace for volatility"," - Jan 10, 2020"
982,Top 5 Things to Watch on Friday Jan. 10," - Jan 10, 2020"
983,U.S. stocks higher at close of trade; Dow Jones Industrial Average up 0.74%," - Jan 09, 2020"
984,"Wall Street notches records on trade optimism, Apple gains"," - Jan 09, 2020"
985,Stocks: Wall Street Notches Record Highs as Geopolitical Jitters Ease," - Jan 09, 2020"
986,U.S. activist investors post strong gains as needling companies pays off," - Dec 24, 2019"
987,U.S. stocks higher at close of trade; Dow Jones Industrial Average up 0.34%," - Dec 23, 2019"
988,Wall Street posts records amid trade optimism; Boeing juices Dow," - Dec 23, 2019"
989,Gold Perks up on Light Volumes as China Risk Stays Alive," - Dec 23, 2019"
990,S&P is the decade's runaway winner," - Dec 23, 2019"
991,Christmas Eve’s Stock Apocalypse Was Another Buy-the-Dip Moment," - Dec 23, 2019"
992,Global shares stall near record high as year draws to close," - Dec 23, 2019"
993,The best year financial markets have ever had?," - Dec 22, 2019"
994,U.S. stocks higher at close of trade; Dow Jones Industrial Average up 0.28%," - Dec 20, 2019"
995,"Stocks - Nasdaq Tops 8,900 as Rally Rolls On"," - Dec 20, 2019"
996,NewsBreak: Stocks Shoot Higher on Trade Deal Report," - Dec 12, 2019"
997,NewsBreak: U.S. Offers to Cancel Dec 15 Tariffs in Return for Ag Purchases - WSJ," - Dec 12, 2019"
998,NewsBreak - Trump Says ‘Very Close’ to China Deal; Markets Gain," - Dec 12, 2019"
999,'Black Swan' index flashes yellow: Wall Street is not scared," - Dec 12, 2019"
1000,"Asian shares climb on dovish Fed, but Brexit hurdle looms"," - Dec 12, 2019"
1001,U.S. stocks higher at close of trade; Dow Jones Industrial Average up 0.11%," - Dec 11, 2019"
1002,"Stocks - Apple, Chips Lead Nasdaq Higher as Fed Stands Pat"," - Dec 11, 2019"
1003,Wall Street posts modest gain as Fed signals rates to hold for some time," - Dec 11, 2019"
1004,U.S. stocks lower at close of trade; Dow Jones Industrial Average down 0.10%," - Dec 10, 2019"
1005,"Stocks - Energy, Health, Tech Shares Lead as Wall Street Waits"," - Dec 10, 2019"
1006,U.S. stocks lower at close of trade; Dow Jones Industrial Average down 0.96%," - Dec 02, 2019"
1007,"Stocks - Trade Battles, Manufacturing Weakness Hit S&P 500"," - Dec 02, 2019"
1008,U.S. stocks retreat on economy and trade jitters," - Dec 02, 2019"
1009,Large investor lays out $31 million options hedge against U.S. stock market drop," - Dec 02, 2019"
1010,Off the radar: U.S. CEOs' jet perks add millions to corporate tax bills," - Dec 02, 2019"
1011,Stocks - Wall Street Falters After Trump Revives Steel Tariffs ," - Dec 02, 2019"
1012,"Stocks - Wall Street Slips on China Fears, Holiday Lethargy"," - Nov 29, 2019"
1013,"Wall Street slips as U.S.-China tensions weigh, investors watch retail"," - Nov 29, 2019"
1014,Stocks - Wall Street Falls on Trade Hurdles Over Hong Kong Bill," - Nov 29, 2019"
1015,Weekly Comic: The Market Bulls Have a Lot to Be Thankful for This Year," - Nov 28, 2019"
1016,U.S. stocks mixed at close of trade; Dow Jones Industrial Average down 0.36%," - Nov 19, 2019"
1017,"Stocks: Home Depot, Kohls, Energy Shares Weigh on Market"," - Nov 19, 2019"
1018,"Dismal retail forecasts drag down Dow, S&P 500"," - Nov 19, 2019"
1019,Oil Plunges 3% as Market Catches up with Empty Trade Deal Talk," - Nov 19, 2019"
1020,NewsBreak: Trump Threatens to Hike Tariffs on China," - Nov 19, 2019"
1021,Stocks - Wall Street Rises on Trade Optimism; Retailers Fall ," - Nov 19, 2019"
1022,Shares push to 22-month high as trade hopes endure," - Nov 19, 2019"
1023,Stocks: S&P Sneaks a Gain After Hitting New Highs on China Trade Worries," - Nov 19, 2019"
1024,U.S. stocks higher at close of trade; Dow Jones Industrial Average up 0.11%," - Nov 18, 2019"
1025,Wall Street ekes out gains as investors await U.S.-China trade clarity," - Nov 18, 2019"
1026,Stocks - Trade Hopes (Again) Send Stocks to New Highs," - Nov 07, 2019"
1027,"Dow, S&P 500 hit record closes as investors digest trade news"," - Nov 07, 2019"
1028,NewsBreak: 10-Year Treasury at Highest Level Since July," - Nov 07, 2019"
1029,Stocks - Dow Jumps to Record Highs on Trade Optimism," - Nov 07, 2019"
1030,U.S. stocks mixed at close of trade; Dow Jones Industrial Average down 0.00%," - Nov 06, 2019"
1031,Stocks - Trade Uncertainty Takes the Fizz out of Rally," - Nov 06, 2019"
1032,"NewsBreak: Trump, Xi Meeting on Trade Deal May Be Delayed"," - Nov 06, 2019"
1033,Wall St. little changed but report trade deal could be delayed weighs," - Nov 06, 2019"
1034,U.S. stocks mixed at close of trade; Dow Jones Industrial Average up 0.11%," - Nov 05, 2019"
1035,"Stocks - Dow, Nasdaq, Transports Move Higher"," - Nov 05, 2019"
1036,"Oil up Almost 3% on Upbeat U.S. Jobs, Trade Talks"," - Nov 01, 2019"
1037,When Did the Indexes Hit Their Closing Highs?," - Nov 01, 2019"
1038,"Jobs data, trade progress boost S&P, Nasdaq to records"," - Nov 01, 2019"
1039,"Gold Whipsaws as Strong Payrolls, Weak ISM Send Mixed Signals"," - Nov 01, 2019"
1040,Nonfarm Payrolls Rise 128K and the Market Cheers," - Nov 01, 2019"
1041,Asian shares at fresh three-month highs on China PMI surprise," - Nov 01, 2019"
1042,"Even after Lyft beat, Wall Street pummels former unicorns"," - Oct 31, 2019"
1043,U.S. stocks lower at close of trade; Dow Jones Industrial Average down 0.52%," - Oct 31, 2019"
1044,Stocks - S&P Falls Back on Economic and Trade Worries," - Oct 31, 2019"
1045,Wall Street retreats from record on trade cloudiness," - Oct 31, 2019"
1046,"Stocks - S&P Struggles on Brexit Storm, Boeing Changes, Tech Weakness"," - Oct 22, 2019"
1047,"Mixed earnings, failed Brexit vote push down S&P 500"," - Oct 22, 2019"
1048,U.S. companies facing worker shortage race to automate," - Oct 22, 2019"
1049,Stocks - Wall Street Mixed After Varied Earnings Reports   ," - Oct 22, 2019"
1050,"Earnings weigh on European stocks, sterling lower before Brexit votes"," - Oct 22, 2019"
1051,U.S. stocks higher at close of trade; Dow Jones Industrial Average up 0.21%," - Oct 21, 2019"
1052,Stocks - Chips Power S&P 500 Above 3000; Boeing Hinders Dow," - Oct 21, 2019"
1053,Trade hopes move S&P 500 close to new record high," - Oct 21, 2019"
1054,Trade hopes move S&P 500 close to new record high," - Oct 21, 2019"
1055,Currency risks? U.S. corporates yawn," - Oct 21, 2019"
1056,"NewsBreak: Fed Members Concerned Markets Pricing in too Many Cuts, Minutes Show"," - Oct 09, 2019"
1057,Wall Street gets tech boost as reports bolster hopes of trade deal," - Oct 09, 2019"
1058,Stocks - Wall Street Opens Higher for First Time in Three Sessions," - Oct 09, 2019"
1059,U.S. stocks lower at close of trade; Dow Jones Industrial Average down 1.19%," - Oct 08, 2019"
1060,Stocks - Wall Street Slumps Again on U.S.-China Tensions," - Oct 08, 2019"
1061,Indexes briefly cut losses in choppy trade after Powell comments," - Oct 08, 2019"
1062,"NewsBreak: Fed to Expand Balance Sheet 'Soon,' Powell Says"," - Oct 08, 2019"
1063,Special Report: Index funds invest trillions but rarely challenge management," - Oct 08, 2019"
1064,Wall Street falls amid caution on U.S.-China trade dispute," - Oct 07, 2019"
1065,U.S. stocks lower at close of trade; Dow Jones Industrial Average down 0.36%," - Oct 07, 2019"
1066,"BOJ's ETF purchase hits over three-year low in September, but unlikely to be tapering"," - Sep 30, 2019"
1067,U.S. stocks lower at close of trade; Dow Jones Industrial Average down 0.26%," - Sep 27, 2019"
1068,Stocks - S&P 500 Ends Lower as White House China Plan Spooks Market," - Sep 27, 2019"
1069,Wall Street drops; White House considers delisting Chinese companies," - Sep 27, 2019"
1070,NewsBreak: Wall Street Trades at Lows on Talk of China Investment Limits," - Sep 27, 2019"
1071,Wall Street drops as White House weighs delisting Chinese companies," - Sep 27, 2019"
1072,NewsBreak: Stocks Sag on Report U.S. May Limit Capital Flows to China," - Sep 27, 2019"
1073,"S&P, Nasdaq fall as White House weighs delisting Chinese companies"," - Sep 27, 2019"
1074,NewsBreak: White House Considering Limits to U.S. Portfolio Flows Into China," - Sep 27, 2019"
1075,"S&P, Nasdaq dragged down by Micron's downbeat outlook"," - Sep 27, 2019"
1076,U.S. Futures Set to Open Slightly Lower Before Fed Decision," - Sep 18, 2019"
1077,Cut and run: How U.S. stocks react in Fed easing cycles," - Sep 18, 2019"
1078,U.S. stocks higher at close of trade; Dow Jones Industrial Average up 0.13%," - Sep 17, 2019"
1079,"Stocks - Wall Street Steady as Oil Fears Fade, Investors Await Fed"," - Sep 17, 2019"
1080,"Wall Street rises as oil fears recede, market awaits Fed"," - Sep 17, 2019"
1081,NewsBreak: Gold Sees Small Gains as Saudis See Oil Output Stabilizing," - Sep 17, 2019"
1082,"Wall Street drops after Saudi attacks, energy stocks spike"," - Sep 16, 2019"
1083,U.S. stocks lower at close of trade; Dow Jones Industrial Average down 0.52%," - Sep 16, 2019"
1084,Stocks - S&P Slumps Despite Rising Oil Fueling Energy Rally," - Sep 16, 2019"
1085,"Oil soars, stocks dip after Saudi supply shock"," - Sep 16, 2019"
1086,Asia stocks set to climb as China-U.S. go back to the negotiating table," - Sep 05, 2019"
1087,U.S. stocks higher at close of trade; Dow Jones Industrial Average up 1.41%," - Sep 05, 2019"
1088,Stocks – China Euphoria Helps S&P to Highest Level in a Month," - Sep 05, 2019"
1089,What trade fears? Wall Street is back in rally mode," - Sep 05, 2019"
1090,NewsBreak: China Euphoria Pushes S&P 500 to Highest Level in Month," - Sep 05, 2019"
1091,U.S. stocks higher at close of trade; Dow Jones Industrial Average up 0.91%," - Sep 04, 2019"
1092,Stocks - Techs Helps S&P Bounce Back From Slump," - Sep 04, 2019"
1093,NewsBreak: U.S. Economy at Modest Pace Despite Trade Uncertainty: Beige Book," - Sep 04, 2019"
1094,Wall St. rises as strong Chinese data eases growth worries," - Sep 04, 2019"
1095,U.S. stocks lower at close of trade; Dow Jones Industrial Average down 1.08%," - Sep 03, 2019"
1096,Fed's commitment to act upstaged by Trump's furor," - Aug 23, 2019"
1097,Stocks - Wall Street Plunges as Trumps Tells US Companies to Leave China," - Aug 23, 2019"
1098,U.S. stocks lower at close of trade; Dow Jones Industrial Average down 2.37%," - Aug 23, 2019"
1099,Stocks: S&P Slumps As Trumps Tells US Companies to Leave China," - Aug 23, 2019"
1100,Stocks - Wall Street Shrugs After Powell's Speech," - Aug 23, 2019"
1101,U.S. stocks mixed at close of trade; Dow Jones Industrial Average up 0.19%," - Aug 22, 2019"
1102,"Wall St. falls after disappointing data, Fed policymakers dampen rate cut hopes"," - Aug 22, 2019"
1103,Stocks - Boeing Boosts Dow While Investors Await Powell," - Aug 22, 2019"
1104,Stocks Fall as Fed Officials Cast Doubt on Cuts," - Aug 22, 2019"
1105,Stocks - Wall Street Rises After Strong Retail Earnings," - Aug 22, 2019"
1106,Top 5 Things to Know in the Market on Friday," - Aug 09, 2019"
1107,Stocks - Markets Rally to Claw Back Early-Week Losses," - Aug 08, 2019"
1108,U.S. stocks higher at close of trade; Dow Jones Industrial Average up 1.43%," - Aug 08, 2019"
1109,"Wall Street jumps, with tech leading the advance"," - Aug 08, 2019"
1110,"Stocks - Wall Street Rises on Upbeat Earnings, China Trade "," - Aug 08, 2019"
1111,Asian Markets Gain Following Recovery in U.S. Stocks," - Aug 07, 2019"
1112,Silver lining to U.S. market sell-off: Fundamentals still seem to matter," - Aug 07, 2019"
1113,Stocks - Wall Street Roars Back from Big Early Losses," - Aug 07, 2019"
1114,U.S. stocks mixed at close of trade; Dow Jones Industrial Average down 0.09%," - Aug 07, 2019"
1115,Exclusive: Saudi Aramco valuation gap persists as IPO talks resume - sources," - Aug 07, 2019"
1116,Trade jitters running high at U.S. companies ahead of new U.S.-China talks," - Jul 29, 2019"
1117,"Stocks - Disney, Intel, Apple Moderate Downward Pressure on Wall Street"," - Jul 29, 2019"
1118,"Mylan stock boost follows long share struggles for company, generics industry"," - Jul 29, 2019"
1119,U.S. stocks mixed at close of trade; Dow Jones Industrial Average up 0.11%," - Jul 29, 2019"
1120,"Wall St. takes a pause in wait for Fed news, trade progress"," - Jul 29, 2019"
1121,Stocks - Wall Street Flat as Traders Pause Before Fed Meeting," - Jul 29, 2019"
1122,Top 5 Things to Know in the Market on Monday," - Jul 29, 2019"
1123,Economic Calendar - Top 5 Things to Watch This Week," - Jul 28, 2019"
1124,"Stocks - Google, Starbucks and T-Mobile Push S&P, Nasdaq to New Highs"," - Jul 26, 2019"
1125,"S&P, Nasdaq hit closing records with help from Alphabet, Starbucks"," - Jul 26, 2019"
1126,U.S. stocks lower at close of trade; Dow Jones Industrial Average down 0.42%," - Jul 17, 2019"
1127,Wall St. falls as CSX results point to damage from trade tensions," - Jul 17, 2019"
1128,Stocks - Wall Street Flat As Investors Digest Bank Earnings Results ," - Jul 17, 2019"
1129,Top 5 Things to Know in the Market on Wednesday," - Jul 17, 2019"
1130,U.S. stocks lower at close of trade; Dow Jones Industrial Average down 0.09%," - Jul 16, 2019"
1131,Stocks – Recent Highs Now Keeping Wall Street in Check," - Jul 16, 2019"
1132,"Wall Street slips as bank earnings, Trump trade comments weigh"," - Jul 16, 2019"
1133,Long Slide in Hedge-Fund Fees Leaves the ‘2 and 20’ Model on the Ropes," - Jul 16, 2019"
1134,Stocks - Wall Street Flat After Mixed Bank Earnings ," - Jul 16, 2019"
1135,Comic: Will A Bad Earnings Season Spoil The Fed’s Rate Cut Party?," - Jul 16, 2019"
1136,Hedge Funds Post Best First Half in Decade," - Jul 08, 2019"
1137,Stocks - Wall Street Falls on Lowered Fed Cut Expectations ," - Jul 08, 2019"
1138,Why It May Be Downhill From Here for Stocks in 2019," - Jul 07, 2019"
1139,Buoyant U.S. stocks at odds with downbeat market signals," - Jul 05, 2019"
1140,U.S. stocks lower at close of trade; Dow Jones Industrial Average down 0.16%," - Jul 05, 2019"
1141,Stocks - Market Sags as Jobs Report Pushes Rates Higher," - Jul 05, 2019"
1142,"U.S. Stocks Slip, Treasuries Tumble on Jobs Data: Markets Wrap"," - Jul 05, 2019"
1143,Stocks - Wall Street Falls After Job Surge Hits Chance of Fed Rate Cut ," - Jul 05, 2019"
1144,‘Not What the Market Wants:’ Payroll Data Is Too Hot for Comfort," - Jul 05, 2019"
1145,Asian shares near two-month highs before U.S. payrolls test," - Jul 05, 2019"
1146,S&P 500 rises on investor optimism ahead of G20 summit," - Jun 27, 2019"
1147,"U.S. economic growth surges in first-quarter, but momentum fizzling"," - Jun 27, 2019"
1148,Boeing shares slip as grounded 737 MAX faces new hurdle," - Jun 27, 2019"
1149,"Stocks - Wall Street Rises on Trade Hopes, Even as Boeing Weighs "," - Jun 27, 2019"
1150,U.S. GDP first-quarter growth unrevised at 3.1%," - Jun 27, 2019"
1151,Russell remake and G20 leave Wall Street primed for blowout volume," - Jun 27, 2019"
1152,U.S. stocks mixed at close of trade; Dow Jones Industrial Average down 0.04%," - Jun 26, 2019"
1153,Buffett-backed Axalta Coating Systems to explore a sale," - Jun 26, 2019"
1154,"Stocks - Techs, Energy Lead Market Despite Rising Rates"," - Jun 26, 2019"
1155,S&P 500 dips as healthcare declines counter tech gains," - Jun 26, 2019"
1156,Stocks - Wall Street Surges on Hopes for China Trade Deal and Lower Rates," - Jun 18, 2019"
1157,"Wall St. rises on hopes for trade talks, Fed rate cuts"," - Jun 18, 2019"
1158,"Oil Rises 3% on Trade Talks, Fed Cut Hopes"," - Jun 18, 2019"
1159,"For Fed's Powell, a gap with markets and Trump may need explaining"," - Jun 18, 2019"
1160,Stocks - Wall Street Surges as Trump to Meet with Xi ," - Jun 18, 2019"
1161,U.S. Treasuries 'most crowded' as investors flee risk: BAML survey," - Jun 18, 2019"
1162,Asia Equities Are on a Wobbling Foundation as Earnings Outlook Dims," - Jun 17, 2019"
1163,U.S. stocks higher at close of trade; Dow Jones Industrial Average up 0.09%," - Jun 17, 2019"
1164,Stocks - Stocks Flat as Financials Fall on Growing Rate-Cut Hopes," - Jun 17, 2019"
1165,S&P 500 ends up slightly as Fed meeting in view," - Jun 17, 2019"
1166,"Asia Stocks Set to Gain, Yen Drops on Mexico News: Markets Wrap"," - Jun 09, 2019"
1167,Wall St. Week Ahead: Top U.S. bond managers betting bond market still has room to run," - Jun 08, 2019"
1168,3 Things Under the Radar This Week," - Jun 08, 2019"
1169,U.S. stocks higher at close of trade; Dow Jones Industrial Average up 1.02%," - Jun 07, 2019"
1170,"Stocks - Wall Street Rallies on Hopes for Lower Rates, Easing Trade Tensions"," - Jun 07, 2019"
1171,"Wall St. rallies on hopes of U.S. rate cut, trade progress"," - Jun 07, 2019"
1172,Stocks Eye Best Week of 2019 on ‘Fed Put’ Wagers: Markets Wrap," - Jun 07, 2019"
1173,"Global stocks rally, and yields, dollar fall; data fans rate cut talk"," - Jun 07, 2019"
