,Article Titles,Date
1773,U.S. stocks lower at close of trade; Dow Jones Industrial Average down 0.18%," - Mar 21, 2018"
1774,Economic projections looking more hawkish; stocks add to gains," - Mar 21, 2018"
1775,Apollo CEO sees Ares offering little incentive for stock conversion," - Mar 21, 2018"
1776,U.S. stocks mixed at close of trade; Dow Jones Industrial Average up 0.47%," - Mar 15, 2018"
1777,"Judge denies report, says AT&T/Time Warner trial begins Monday"," - Mar 15, 2018"
1778,Dow gains as trade war worries ebb on Navarro's comments," - Mar 15, 2018"
1779,Oil gains as risk appetite boosts equities," - Mar 15, 2018"
1780,Stocks- Wall Street Flat After Unemployment Data," - Mar 15, 2018"
1781,Investors still in love with growth stocks risk losing out on value," - Mar 15, 2018"
1782,Credit Suisse sued over U.S. 'volatility' product losses," - Mar 14, 2018"
1783,U.S. stocks lower at close of trade; Dow Jones Industrial Average down 1.00%," - Mar 14, 2018"
1784,Dow sheds 250 points as trade war worries weigh on industrials," - Mar 14, 2018"
1785,Stocks and yields both move lower on session," - Mar 14, 2018"
1786,Asian Equities Gains On Easing North Korea Tensions," - Mar 09, 2018"
1787,Asian Equities Rise As North Korea Offers To Stop Nuclear Testing," - Mar 08, 2018"
1788,Wall Street laments Cohn leaving White House but no one eager to take his place," - Mar 08, 2018"
1789,Traders Baffled as Focus Shifts From Tariffs to Jobs -- and Back," - Mar 08, 2018"
1790,Wall Street rises as Trump softens tariff plan," - Mar 08, 2018"
1791,U.S. stocks higher at close of trade; Dow Jones Industrial Average up 0.33%," - Mar 08, 2018"
1792,Tensions Between China and the U.S. Run Deeper Than Just Trade," - Mar 08, 2018"
1793,VIX 'fear gauge' seen as incomplete measure of U.S. equities risk," - Mar 08, 2018"
1794,Who's the enemy? Draghi asks as trade war tensions simmer," - Mar 08, 2018"
1795,Stocks- Wall Street Rises As Trade War Fears Dissipate," - Mar 08, 2018"
1796,"Global stocks, dollar tumble on global trade war fears"," - Mar 02, 2018"
1797,Bull Market Poise Gone Missing From S&P 500 as Bad Days Pile Up," - Mar 02, 2018"
1798,Stocks- Wall Street Slumps Amid Trade War Worry ," - Mar 02, 2018"
1799,Sizable losses in store at the open," - Mar 02, 2018"
1800,Asian Equities Lower Following Trade War Fears; Steel Makers Underperform ," - Mar 02, 2018"
1801,Gold Gains Amid Trade War Fears," - Mar 02, 2018"
1802,Asian Equities Extend Wall Street Rout As U.S. Tariff Sparks Trade War Fears ," - Mar 01, 2018"
1803,Trump Says U.S. Will Impose Harsh Tariffs on Steel and Aluminum," - Mar 01, 2018"
1804,Fed chief Powell says no evidence U.S. economy overheating," - Mar 01, 2018"
1805,Wall Street drops over 1 percent on Trump tariff fears," - Mar 01, 2018"
1806,"Asian shares mostly firmer, dollar loses early edge"," - Feb 26, 2018"
1807,Buffett says 'terrible mistake' for long-term investors to be in bonds," - Feb 24, 2018"
1808,U.S. stocks higher at close of trade; Dow Jones Industrial Average up 1.39%," - Feb 23, 2018"
1809,"Surging bond yields to pinch home owners, retirees"," - Feb 23, 2018"
1810,"Stocks climb as Fed eases rate concern, tech rises"," - Feb 23, 2018"
1811,Stocks- Wall Street Rises as Investors Look Ahead to Fed Speeches," - Feb 23, 2018"
1812," Wall Street Optimism Returns, As Correction Seems Like Blip   "," - Feb 23, 2018"
1813,U.S. fund investors creep back in to market: Lipper," - Feb 23, 2018"
1814,U.S. shale investors still waiting on payoff from oil boom," - Feb 23, 2018"
1815,Asian Equities Ends Week On Positive Note As Fears of Rate Hikes Ease," - Feb 23, 2018"
1816,"World shares set for best week since 2011, dollar hits lowest since 2014"," - Feb 16, 2018"
1817,Strong earnings help European shares recover from sell-off," - Feb 16, 2018"
1818,U.S. 'junk' bond funds hit by second biggest cash withdrawals: Lipper," - Feb 15, 2018"
1819,"U.S. stock investors shrug off higher yields, for now"," - Feb 15, 2018"
1820,U.S. market gurus who predicted selloff say current calm an illusion," - Feb 15, 2018"
1821,"U.S. stock volatility shock wanes, VIX futures signal smoother sailing"," - Feb 15, 2018"
1822,Wall Street builds on rally while Apple shines," - Feb 15, 2018"
1823,U.S. stocks higher at close of trade; Dow Jones Industrial Average up 1.05%," - Feb 15, 2018"
1824,Broad-basket commods funds post largest net inflow in seven years," - Feb 15, 2018"
1825,"Retirement savers, how much market risk can you handle?"," - Feb 15, 2018"
1826,Asian Equities Extend Gains In Afternoon Sessions But Nikkei Underperforms," - Feb 13, 2018"
1827,Asian Shares Up With Shanghai In Strong Rebound Heading Into Lunar New Year," - Feb 12, 2018"
1828,Asia Stocks Gain as Japan Catches Global Rebound: Markets Wrap," - Feb 12, 2018"
1829,Calm Returns To Asian Equities Markets As Wall Street Rebounds For Second Day," - Feb 12, 2018"
1830,History suggests strong economy can ward off bear market," - Feb 12, 2018"
1831,Global growth outlook seen intact as stock market rebounds," - Feb 12, 2018"
1832,Share buybacks could add fuel to Wall Street rebound," - Feb 12, 2018"
1833,"Rattled by U.S. fiscal, monetary tug-of-war, investors start looking abroad"," - Feb 12, 2018"
1834,Wall Street bounces back after tumultuous week," - Feb 12, 2018"
1835,U.S. stocks higher at close of trade; Dow Jones Industrial Average up 1.70%," - Feb 12, 2018"
1836,Investors withdraw record $23.9 billion from U.S.-based stock funds: Lipper," - Feb 08, 2018"
1837,"Twitter surprises with revenue turnaround, shares surge"," - Feb 08, 2018"
1838,Dow Drops 1000 Points Set For Worst Week Since Oct 2008; Nvidia Up 10% on Earnings," - Feb 08, 2018"
1839,Stocks Enter Correction as Rate-Hike Fears Return: Markets Wrap," - Feb 08, 2018"
1840,JPM's Kolanovic Says Some Systematic Strategies May Sell at Lows," - Feb 08, 2018"
1841,U.S. stocks lower at close of trade; Dow Jones Industrial Average down 2.51%," - Feb 08, 2018"
1842,Mom-and-pop investors undeterred by wild U.S. stock market," - Feb 08, 2018"
1843,Trillion-dollar risk lurks if market volatility doesn't abate," - Feb 08, 2018"
1844,Still An Uphill Battle for Women CEOs   ," - Feb 08, 2018"
1845,Stocks- Wall Street Slumps As Global Sell Off Continues," - Feb 08, 2018"
1846,U.S. trade deficit rises to nine-year high on robust imports," - Feb 06, 2018"
1847,"This Is a Global Equity Maelstrom, Not a Bond Tantrum. For Now"," - Feb 06, 2018"
1848,Retail stocks attract attention amid market volatility," - Feb 06, 2018"
1849,Wall Street drops in volatile trade after steep falls," - Feb 06, 2018"
1850,White House Distances Trump from Historic Market Crash   ," - Feb 06, 2018"
1851,"Bond bears smell blood, others claw for buying opportunity"," - Feb 06, 2018"
1852,Stocks- Wall Street Struggles to Recover," - Feb 06, 2018"
1853,Credit Suisse is pulling the plug on an investment product that just got wiped out with the stock market's drop," - Feb 06, 2018"
1854,Dividend plays on slippery ground as bond yields steepen," - Feb 06, 2018"
1855,VIX Sellers Wait Out the Storm to Drive Volatility Lower Again," - Feb 06, 2018"
1856,Caution after Wall Street caps off worst week in years," - Feb 03, 2018"
1857,Interest rate angst trips up U.S. equity bull market," - Feb 03, 2018"
1858,Homebuilders slammed for ninth straight day as mortgage rates climb," - Feb 02, 2018"
1859,Dow sees worst day in two years as bond yields jump," - Feb 02, 2018"
1860,Global stocks plunge as U.S. jobs data spikes bond yields," - Feb 02, 2018"
1861,'VIX elephant' rides volatility wave to erase hedging losses," - Feb 02, 2018"
1862,U.S. stocks lower at close of trade; Dow Jones Industrial Average down 2.54%," - Feb 02, 2018"
1863,Dow Jones Plunges 660 Points as Rising Bond Yields Halt Rally ," - Feb 02, 2018"
1864,Rate Angst Sends Dow Down 600 Points as Bonds Sink: Markets Wrap," - Feb 02, 2018"
1865,"Exxon, Chevron shares plunge after weak results spook Street"," - Feb 02, 2018"
1866,"Dow, S&P 500 suffer worst one-day fall in five months as Apple drags"," - Jan 29, 2018"
1867,"U.S. pensions seen adding bonds, paring stocks: Wells Fargo"," - Jan 29, 2018"
1868,U.S. stocks lower at close of trade; Dow Jones Industrial Average down 0.67%," - Jan 29, 2018"
1869,Risk Assets in Danger Zone as Bull Feeding Time Is a Frenzy," - Jan 29, 2018"
1870,"After Disappointing 2017, Oil Stocks Show Promise   "," - Jan 29, 2018"
1871,Stocks are facing a barrage of sell signals as the market's 'non-stop euphoric cabaret' rages on," - Jan 29, 2018"
1872,"Stocks - U.S. Futures Pull Back From Record Highs in Key Week for Earnings, Data"," - Jan 29, 2018"
1873,Top 5 Things to Know in the Market on Monday," - Jan 29, 2018"
1874,"Asian Shares Mostly Weaker With Caution On Dollar, Data Sets Eyed"," - Jan 28, 2018"
1875,Wall Street Weekahead: State of the Union more likely to raise eyebrows than stocks," - Jan 28, 2018"
1876,JPMorgan rolls out $20 billion investment plan after tax gains," - Jan 23, 2018"
1877,Stocks- Wall Street Mixed After Trump Approves Solar Tariff ," - Jan 23, 2018"
1878,Musk to get no salary unless Tesla hits milestones," - Jan 23, 2018"
1879,Futures up with focus on earnings," - Jan 23, 2018"
1880,Top 5 Things to Know in the Market on Tuesday," - Jan 23, 2018"
1881,"Asian Shares Gain As US Budget Impasse Ends For Now, BoJ Noted"," - Jan 22, 2018"
1882,"Exclusive: Ackman cuts staff, shuns limelight as he seeks to turn around fund"," - Jan 22, 2018"
1883,Stocks hit record as senators reach deal to end shutdown," - Jan 22, 2018"
1884,Dow Jones Bags 140 Points as Senate Strikes Deal to End Shutdown," - Jan 22, 2018"
1885,"Icahn, Deason join forces to demand Xerox explore options"," - Jan 22, 2018"
1886,U.S. stocks lower at close of trade; Dow Jones Industrial Average down 0.04%," - Jan 16, 2018"
1887,Dow Jones Reverses Nearly 300 Point Gain to Close Lower as Shutdown Fears Grow," - Jan 16, 2018"
1888,"Stock 'fear index' snaps out of extended snooze, jumps to six-week high"," - Jan 16, 2018"
1889,"Stocks Fall, Reversing Gains After Record Surge: Markets Wrap"," - Jan 16, 2018"
1890,"Global stocks retreat from early gains as oil, copper fall"," - Jan 16, 2018"
1891,"Stocks- Dow Hits 26,000 Amid Strong Earnings Results"," - Jan 16, 2018"
1892,Consider buying the dip in REITs - Morgan Stanley," - Jan 16, 2018"
1893,Let's Hope Crypto Hedge Funds Can Handle a Bitcoin Bust: Gadfly," - Jan 16, 2018"
1894,Euro hits three-year high as Europe leads global optimism," - Jan 15, 2018"
1895,Asian Markets Mostly Gain with The Nikkei 225 Up On Softbank News," - Jan 14, 2018"
1896,Stocks- Wall Street Inches Up as Tech Stocks Fall ," - Jan 09, 2018"
1897,U.S. Job Openings Unexpectedly Drop in November," - Jan 09, 2018"
1898,Warren Buffett's Berkshire Hathaway could get a $37 billion windfall from tax cuts," - Jan 09, 2018"
1899,GOLDMAN SACHS: 2 areas of tax reform could throw investors for a loop this earnings season," - Jan 09, 2018"
1900,Gold Has a Lesson for Stocks and Bitcoin After Fed Rate Increase," - Jan 09, 2018"
1901,Top 5 Things to Know in the Market on Tuesday," - Jan 09, 2018"
1902,Asian Shares Gain With Nikkei 225 Near Levels Not Seen Since 1991," - Jan 08, 2018"
1903,"S&P keeps New Year's rally alive, Dow eases"," - Jan 08, 2018"
1904,S&P 500 extends new year's gains; dollar up as euro falters," - Jan 08, 2018"
1905,U.S. stocks mixed at close of trade; Dow Jones Industrial Average down 0.05%," - Jan 08, 2018"
1906,Bargain Bin: ETFs for value hunters," - Jan 03, 2018"
1907,Stocks- Wall Street Gains Steam as Investors Look to Fed Minutes," - Jan 03, 2018"
1908, U.S. Manufacturing Activity Unexpectedly Strengthens in December – ISM," - Jan 03, 2018"
1909,Blackstone's Byron Wien unveils his big surprises for 2018," - Jan 03, 2018"
1910,BAML: Stocks could surge 19% this year because investors are the right kind of cautious," - Jan 03, 2018"
1911,World stocks smash new records as New Year party rolls on," - Jan 03, 2018"
1912,Asian Shares Gain With Shanghai Up Almost 1% Despite Trump Nuclear Tweet," - Jan 02, 2018"
1913,"Wall Street starts year on strong note; Nasdaq ends above 7,000"," - Jan 02, 2018"
1914,U.S. stocks higher at close of trade; Dow Jones Industrial Average up 0.42%," - Jan 02, 2018"
1915,"Nasdaq Closes Above 7,000 For First Time Ever as Tech Makes Bullish Start to 2018"," - Jan 02, 2018"
1916,Top 5 Things to Know in the Market on Wednesday," - Dec 27, 2017"
1917,"Commodities gain, equities pause 2017 rally in holiday trading"," - Dec 26, 2017"
1918,Apple and its suppliers weigh on Wall Street," - Dec 26, 2017"
1919,Nasdaq Closes Lower as Apple Sheds 2.5%," - Dec 26, 2017"
1920,Emerging markets blow past S&P in 2017," - Dec 26, 2017"
1921,Bitcoin Soars 12% as Recovery Gathers Momentum," - Dec 26, 2017"
1922,Commodities in 2018 and beyond?," - Dec 26, 2017"
1923,Apple Drags Down Tech Shares as Oil Rises Past $59: Markets Wrap," - Dec 26, 2017"
1924,Retail names on the move on strong early Xmas numbers," - Dec 26, 2017"
1925,"Top small-cap funds of 2017 focus on healthcare, tech in year ahead"," - Dec 26, 2017"
1926,Dow Jones Notches 140 Points Ahead of US Tax Vote," - Dec 18, 2017"
1927,Dow about to set a record for setting records," - Dec 18, 2017"
1928,Stocks- Tax Bill Pushes Wall Street to Record Highs," - Dec 18, 2017"
1929,Yield Curve Inversions and Stocks Are a Toxic Mix: Ben Carlson," - Dec 18, 2017"
1930,Payment processor Total System Services to buy Cayan for $1.05 billion," - Dec 18, 2017"
1931,AES to sell Philippines businesses for $1.05B," - Dec 18, 2017"
1932,Vanguard declares quarterly distribution on ETF Funds," - Dec 18, 2017"
1933,Asian Shares Mostly Higher With The Nikkei 225 Up Over 1%," - Dec 17, 2017"
1934,"Healthcare draws election-year worry, but 2016 repeat not seen"," - Dec 15, 2017"
1935,Factbox: Trump on Twitter (December 15) - Quantico," - Dec 15, 2017"
1936,Wall Street closes higher ahead of Fed meeting; stocks rise worldwide," - Dec 11, 2017"
1937,"Dow Jones Closes at Record High as Tech, Energy Soar "," - Dec 11, 2017"
1938,"Explosion rocks New York commuter hub, suspect in custody"," - Dec 11, 2017"
1939,Stocks- Wall Street Flat After Explosion in New York Commuter Hub," - Dec 11, 2017"
1940,"Bakers, farmers struggle to make any dough on poor wheat crop"," - Dec 11, 2017"
1941,Icahn nominates four directors to Xerox's board," - Dec 11, 2017"
1942,Top 5 Things to Know in the Market on Monday," - Dec 11, 2017"
1943,Asian Shares Gain On Lead From Wall Street Last Week," - Dec 10, 2017"
1944,Tax-loss selling to pressure 2017's losers in December," - Dec 08, 2017"
1945,Top 5 Things That Moved Markets This Past Week," - Dec 08, 2017"
1946,Oppenheimer Financials Sector Revenue ETF (RWW) November Summary," - Dec 04, 2017"
1947,Oppenheimer Large Cap Revenue ETF (RWL) November Summary," - Dec 04, 2017"
1948,Money continues to rotate out of tech," - Dec 04, 2017"
1949,Shares of big U.S. banks jump as Senate approves tax overhaul," - Dec 04, 2017"
1950,Stocks- Wall Street Surges After Tax Bill Approved," - Dec 04, 2017"
1951,U.S. Factory Orders Drop Less Than Feared in October," - Dec 04, 2017"
1952,Oppenheimer ESG Revenue ETF (ESGL) November Summary," - Dec 04, 2017"
1953,FlexShares Disciplined Duration MBS Index ETF (MBSD) November Summary," - Dec 04, 2017"
1954,Oppenheimer Global ESG Revenue ETF (ESGF) November Summary," - Dec 04, 2017"
1955,Invesco Diversified Dividend Fund A (LCEAX) November Summary," - Dec 04, 2017"
1956,"Valuations highest since 1900, by one measure - Goldman"," - Nov 29, 2017"
1957,"Bitcoin Heads to $11,000 as Bubble Warnings Fail to Cool Market"," - Nov 29, 2017"
1958,Senate Republicans shove tax bill ahead; spending fight erupts," - Nov 28, 2017"
1959,U.S. stocks higher at close of trade; Dow Jones Industrial Average up 1.09%," - Nov 28, 2017"
1960,Surging banks lead Wall Street to highs as tax plan advances," - Nov 28, 2017"
1961,Dow Jones Closes at Record on Tax Reform Progress ," - Nov 28, 2017"
1962,"Stocks, Greenback Gain as Tax Reform Passes Hurdle: Markets Wrap"," - Nov 28, 2017"
1963,Tech stock rally hogs global market spotlight but ownership not cheap," - Nov 28, 2017"
1964,Stocks- S&P At All Time High as Powell Hearing Underway," - Nov 28, 2017"
1965,U.S. Consumer Confidence Unexpectedly Hits 17-Year High in November," - Nov 28, 2017"
1966,"Asian Shares Gain On Wall Street Lead, Watching US Tax Cut Process"," - Nov 20, 2017"
1967,"Dow Jones Closes Higher as Financials, Telecoms Rally "," - Nov 20, 2017"
1968,"Wall Street ticks up, lifted by Verizon, chipmakers"," - Nov 20, 2017"
1969,U.S. stocks higher at close of trade; Dow Jones Industrial Average up 0.31%," - Nov 20, 2017"
1970,Charting the U.S. Economy Yellen Will Leave to Successor Powell," - Nov 20, 2017"
1971,Fast-food chains outperform in Q3," - Nov 20, 2017"
1972,Stocks- Wall Street Inches Forward Amid Political Uncertainty," - Nov 20, 2017"
1973,"Buybacks fall out of favor, begin to lag"," - Nov 20, 2017"
1974,Top 5 Things to Know in the Market on Monday," - Nov 20, 2017"
1975,Asian Shares Dip On wall Street Lead And Ahead Of US Holiday," - Nov 19, 2017"
1976,"GE to shrink, investors worry it will be less profitable"," - Nov 13, 2017"
1977,Stocks- Wall Street Dips Down Amid Tax Reform," - Nov 13, 2017"
1978,Poor earning updates keep European shares at 12-day low," - Nov 13, 2017"
1979,"Asia shares slip on U.S. tax uncertainty, sterling falls on doubts over May"," - Nov 13, 2017"
1980,"Asian Shares Mixed On Valuation Concerns, Risk Up With Theresa May Under Pressure"," - Nov 12, 2017"
1981,Wall Street bonuses may jump 10 percent this year: report," - Nov 12, 2017"
1982,Membership revoked? Veteran GE's spot in exclusive Dow may be shaky," - Nov 12, 2017"
1983,"Master limited partnerships poised for bounce, but could be short-lived"," - Nov 11, 2017"
1984,The 20 percent club: hedge fund stars of an industry rebound," - Nov 10, 2017"
1985,Doubts about Trump tax cuts weigh on Wall Street," - Nov 10, 2017"
1986,Republicans push ahead with U.S. tax bill as Democrats sharpen attacks," - Nov 06, 2017"
1987,Wall Street hits record high as investors eye mergers," - Nov 06, 2017"
1988,Dow Jones Closes Higher on Dealmaking Revival ," - Nov 06, 2017"
1989,U.S. stocks higher at close of trade; Dow Jones Industrial Average up 0.04%," - Nov 06, 2017"
1990,Afternoon surge carries oil past $57 per barrel," - Nov 06, 2017"
1991,Stocks- Wall Street Flat After Fed President Dudley Announces Retirement," - Nov 06, 2017"
1992,Trump's Policies Have Done Almost Nothing for Stocks: Neil Dutta," - Nov 06, 2017"
1993,Asian Shares Mostly Weaker As Saudi Shakeup Hits Sentiment," - Nov 05, 2017"
1994,U.S. dollar enters center stage for earnings," - Nov 03, 2017"
1995,U.S. stocks higher at close of trade; Dow Jones Industrial Average up 0.10%," - Nov 03, 2017"
1996,Traders don't want to get burned again by Trump's tax reform promises," - Nov 01, 2017"
1997,U.S. ISM Manufacturing PMI Falls to 58.7 in October vs. 59.5 Forecast," - Nov 01, 2017"
1998,"Stocks - U.S. Futures Point to Higher Open, More Earnings on Tap"," - Nov 01, 2017"
1999,Top 5 Things to Know in the Market on Wednesday," - Nov 01, 2017"
2000,"Asian Shares Gain With Nikkei 225 Up 1.42%, Regional PMIs Noted"," - Nov 01, 2017"
2001,U.S. stocks higher at close of trade; Dow Jones Industrial Average up 0.12%," - Oct 31, 2017"
2002,"Wall St. ends October on high note, led by tech, consumer staples"," - Oct 31, 2017"
2003,"Nasdaq Closes at Record High, Posts 4th Straight Monthly Gain"," - Oct 31, 2017"
2004,"Bitcoin Allure Too Much for CME, Now Eyeing Futures Contract"," - Oct 31, 2017"
2005,"World stocks on tap for 12th month of gains, dollar edges up"," - Oct 31, 2017"
2006,"Stocks - Twitter, Ford Support Gains on Wall Street"," - Oct 26, 2017"
2007,Stocks- Wall Street Mixed Amid Flurry of Varied Earnings," - Oct 26, 2017"
2008,"U.S. Pending Home Sales Flat in September, Missing Forecasts"," - Oct 26, 2017"
2009,"Oh, behave: How to make sense of behavioral ETFs"," - Oct 26, 2017"
2010,Top 5 Things to Know in the Market on Thursday," - Oct 26, 2017"
2011,GE's CEO sees more partnerships ahead for digital business," - Oct 26, 2017"
2012,Nikkei 225 Recovers As Asian Shares Trade Mixed," - Oct 26, 2017"
2013,"Higher bond yields, soft earnings weigh on Wall St."," - Oct 25, 2017"
2014,U.S. stocks lower at close of trade; Dow Jones Industrial Average down 0.48%," - Oct 25, 2017"
2015,Dow Jones Sheds 112 points as Earnings Season Hits Rough Patch," - Oct 25, 2017"
2016,"Fidelity retirement funds warm to Canada, cool to emerging markets"," - Oct 19, 2017"
2017,U.S. stocks mixed at close of trade; Dow Jones Industrial Average up 0.02%," - Oct 19, 2017"
2018,"Dow Jones Recovers from Slump, Notches Record Close"," - Oct 19, 2017"
2019,"Buckle Up Stock Investors It's Gonna Be a Bumpy Ride, BofA Warns"," - Oct 19, 2017"
2020,Stocks- Wall Street Edges Down After Record High," - Oct 19, 2017"
2021,Shock of Volatility Wakens Stock Traders From Two-Month Slumber," - Oct 19, 2017"
2022,GOLDMAN SACHS: Here's the only strategy you need to crush earnings season," - Oct 19, 2017"
2023,Could the 1987 stock market crash happen again?," - Oct 19, 2017"
2024,"Thirty years ago this week, Wall Street slid into the abyss"," - Oct 19, 2017"
2025,"Asian Shares Mixed With Nikkei 225 Up, Shanghai Down After China GDP"," - Oct 18, 2017"
2026,Dow Jones Snaps 2-Day Winning Streak as Earnings Season Gets Underway," - Oct 12, 2017"
2027,New Nobel Prize economist Thaler stumped by record markets," - Oct 12, 2017"
2028,Emerging market tech stock boom gives fund managers a headache," - Oct 12, 2017"
2029,Nikkei 225 Heads Toward Decade High As Asian Shares Mostly Gain," - Oct 12, 2017"
2030,GE stock hits 4-year low as analysts debate possibility of dividend cut," - Oct 11, 2017"
2031,U.S. stocks higher at close of trade; Dow Jones Industrial Average up 0.18%," - Oct 11, 2017"
2032,Dow Notches Record High as Fed Minutes Reveal Inflation Jitters Persist," - Oct 11, 2017"
2033,Bullish flows into financial ETF belie worries ahead of bank results," - Oct 11, 2017"
2034,"U.S. Treasuries, Wall Street stocks steady after Fed minutes"," - Oct 11, 2017"
2035,"Dow inches up to record-high on gains in J&J, Wal-Mart"," - Oct 11, 2017"
2036,"Asian Shares Mixed, Nikkei 225 Shows Fresh Gains"," - Oct 03, 2017"
2037,U.S. stocks higher at close of trade; Dow Jones Industrial Average up 0.37%," - Oct 03, 2017"
2038,Dow Jones Extends Winning Streak to Fifth Session as Rally Continues," - Oct 03, 2017"
2039,Wall St. gains; autos rise after sales data," - Oct 03, 2017"
2040,"NRF sees holiday sales up 3.6-4 percent, slightly below 2016's growth"," - Oct 03, 2017"
2041,Oppenheimer Large Cap Revenue ETF (RWL) September Summary," - Oct 03, 2017"
2042,Oppenheimer Financials Sector Revenue ETF (RWW) September Summary," - Oct 03, 2017"
2043,Invesco Global Real Estate Income Fund A (ASRAX) September Summary," - Oct 03, 2017"
2044,Oppenheimer Global ESG Revenue ETF (ESGF) September Summary," - Oct 03, 2017"
2045,Oppenheimer ESG Revenue ETF (ESGL) September Summary," - Oct 03, 2017"
2046,U.S. pending home sales decline more than forecast in August," - Sep 27, 2017"
2047,Nikkei Dips In Light Regional Data Day With Investor Focus On U.S. Tax Policy," - Sep 27, 2017"
2048,"Stocks waffle amid North Korea jitters, dollar gains"," - Sep 26, 2017"
2049,Nasdaq Closes Higher as Tech Stocks Rebound," - Sep 26, 2017"
2050,U.S. stocks mixed at close of trade; Dow Jones Industrial Average down 0.05%," - Sep 26, 2017"
2051,Wall St. ends flat after Yellen; tech shares bounce," - Sep 26, 2017"
2052,Active fund managers ride tech stocks to best performance since 2009," - Sep 26, 2017"
2053,ICE announces launch of FANG-based tech index," - Sep 26, 2017"
2054,Health stocks to watch in GOP's latest Obamacare repeal gambit," - Sep 26, 2017"
2055,Stocks – Wall Street Recovers While Markets Wait for Yellen," - Sep 26, 2017"
2056,Top 5 Things to Know in the Market on Tuesday," - Sep 19, 2017"
2057,Stocks - Nikkei Powers Ahead In Mixed Asian Trade With Shanghai Down," - Sep 19, 2017"
2058,"Top U.S. funds took slightly tougher stand on pay, review finds"," - Sep 18, 2017"
2059,"Global stocks, dollar rise as investors turn eyes to Fed"," - Sep 18, 2017"
2060,U.S. stocks higher at close of trade; Dow Jones Industrial Average up 0.28%," - Sep 18, 2017"
2061,Dow Notches 5th Straight Record Close as Financials Surge," - Sep 18, 2017"
2062,"Wall St. clings to records, helped by banks; tech falters"," - Sep 18, 2017"
2063,Banks lead gains as rate surge continues," - Sep 18, 2017"
2064,Stocks - Asian Shares Gain As Market Comfortable Heading Into Fed Meeting," - Sep 18, 2017"
2065,"This week's rally in energy stocks could keep going, analysts say"," - Sep 16, 2017"
2066,High dividend stocks may find favor as market headwinds abound," - Sep 08, 2017"
2067,U.S. stocks mixed at close of trade; Dow Jones Industrial Average up 0.06%," - Sep 08, 2017"
2068,US stocks close lower: Nasdaq snaps 2-week winning streak ," - Sep 08, 2017"
2069,"When returns are low, reaching for more is usually unwise: James Saft"," - Sep 08, 2017"
2070,U.S. defense rally may stall even as North Korea tensions flare," - Sep 08, 2017"
2071,REITs matched S&P 500 in August with marginal gain," - Sep 08, 2017"
