,Article Titles,Date
0,U.S. stocks lower at close of trade; Dow Jones Industrial Average down 1.51%, - 27 minutes ago
1,"Stocks sink, notably tech, as Treasury yields jump", - 1 hour ago
2,"S&P 500 Closes Lower as Banks, Tech Lead Sea of Red on Wall Street", - 1 hour ago
3,S&P 500 on Back Foot as Goldman Leads Rout in Financials, - 2 hours ago
4,Inverse ETFs Dominate as Stocks Struggle Again on Tuesday, - 2 hours ago
5,RSP Right Idea for 2022 Diversification, - 6 hours ago
6,Deep Dive: This is the window of time when value can outperform growth in the stock market, - 6 hours ago
7,S&P 500 Takes Beating on Tuesday, - 6 hours ago
8,Brett Arends's ROI: Beware this ‘dangerous blessing’ for 401(k)s, - 7 hours ago
9,"Wall Street Opens Lower on Earnings Misses, Inflation Fear; Dow Down 500 Pts", - 8 hours ago
10,U.S. stocks higher at close of trade; Dow Jones Industrial Average up 0.51%," - Jan 11, 2022"
11,"S&P 500 Rides Tech, Energy Rally as Powell Soothes Tightening Fears"," - Jan 11, 2022"
12,"U.S. stocks bounce, investors digest news of 2022 rate hikes"," - Jan 11, 2022"
13,S&P 500 Climbs as Tech Comeback Continues on Less Hawkish Powell," - Jan 11, 2022"
14,"Fed balance sheet drawdown coming, says Powell at confirmation hearing"," - Jan 11, 2022"
15,"Analysis-After U.S. bank stock surge, options traders brace for earnings-fueled volatility"," - Jan 11, 2022"
16,Wall Street Opens Lower as Fed Officials Keep Mood Cautious; Dow Down 240 Pts," - Jan 11, 2022"
17,Weekly Comic: Testing Times for Gold and Bitcoin," - Jan 11, 2022"
18,Strategists From Goldman Sachs to UBS Say Buy Dip in Stocks," - Jan 11, 2022"
19,Nasdaq ekes out gain in late session comeback," - Jan 10, 2022"
20,Factbox-Wall Street analysts' 2022 outlook for S&P 500," - Jan 05, 2022"
21,"Citigroup sees S&P 500 breaching 5,000-mark by year-end on robust earnings"," - Jan 05, 2022"
22,"Dow posts closing record high for 2nd day, boosted by banks"," - Jan 04, 2022"
23,U.S. stocks mixed at close of trade; Dow Jones Industrial Average up 0.59%," - Jan 04, 2022"
24,"Apple retreats again, after valuation tops $3 trillion again"," - Jan 04, 2022"
25,Wall Street pares risk-taking but stays bullish," - Jan 04, 2022"
26,"Airline Schedules, Phone Truce, Car Wars: 3 Things to Watch"," - Jan 04, 2022"
27,U.S. manufacturing catches breath; supply logjam starting to break up," - Jan 04, 2022"
28,Wall Street Opens at Fresh Highs on Omicron Hopes; Dow up 225 Pts," - Jan 04, 2022"
29,Apple Hits $3 Trillion Market Cap Again," - Jan 04, 2022"
30,"Dollar Down, but Investors Struggle to Grasp Real Direction due to Thin Volumes"," - Dec 28, 2021"
31,S&P 500 ends lower after four-day rally to record high," - Dec 28, 2021"
32,U.S. stocks mixed at close of trade; Dow Jones Industrial Average up 0.26%," - Dec 28, 2021"
33,"S&P 500 Snaps Record Run After Briefly Topping 4,800"," - Dec 28, 2021"
34,S&P 500 Eases From Record as Tech Stumble Offsets Rebound in Travel Stocks," - Dec 28, 2021"
35,"Dollar lifted by safe-haven flows, Fed expectations"," - Dec 28, 2021"
36,European Markets Trade Higher in Quiet Tuesday Trading," - Dec 28, 2021"
37,"Oil Up, European Natural Gas Down, S&P 500 All-Time Highs - What's Moving Markets"," - Dec 28, 2021"
38,Gold Edges Higher as Traders Weigh Record Covid-19 Infections," - Dec 28, 2021"
39,Vipshop Trades Weaker After Cutting Current-Quarter Guidance," - Dec 28, 2021"
40,"Wall Street surges after Omicron selloff, with boost from Nike, Micron"," - Dec 21, 2021"
41,S&P 500 Jumps as Investors Swoop in on Beaten Down Stocks After Rout," - Dec 21, 2021"
42,Wall Street Opens Higher as Micron Earnings Reassure; Dow up 220 Pts," - Dec 21, 2021"
43,"Dow Futures Rise 325 Pts; Nike, Micron Results Boost Sentiment"," - Dec 21, 2021"
44,"Asian Stocks Up, but Omicron Threat Caps Overall Gains"," - Dec 20, 2021"
45,"Wall Street skids on Omicron worry, obstacle to Biden social-spending package"," - Dec 20, 2021"
46,"Wall Street ends lower on Omicron, Biden spending plan setbacks; oil falters"," - Dec 20, 2021"
47,U.S. stocks lower at close of trade; Dow Jones Industrial Average down 1.23%," - Dec 20, 2021"
48,S&P 500 Staggers as Growing Omicron Fears Weigh," - Dec 20, 2021"
49,S&P 500 Slips as Bulls Scatter on Omicron-Led Fears," - Dec 20, 2021"
50,S&P 500 Eases From Lows as Tech Cuts Some Losses Ahead of Fed Meeting," - Dec 14, 2021"
51,BlackRock adds diversity target for U.S. boardrooms," - Dec 14, 2021"
52,Wall Street Opens Mixed as PPI Reinforces Fed Concerns; Dow up 40 Pts," - Dec 14, 2021"
53,"U.S. Futures Edge Lower; PPI Data, Fed Meeting in Focus"," - Dec 14, 2021"
54,Apple closes in on $3 trillion market value," - Dec 13, 2021"
55,Wall Street ends down; investors eye Omicron and Fed meeting," - Dec 13, 2021"
56,Stocks fall as markets await central bank meetings," - Dec 13, 2021"
57,U.S. stocks lower at close of trade; Dow Jones Industrial Average down 0.89%," - Dec 13, 2021"
58,S&P 500 Eases From Record as Omicron-Fueled Jitters Dent Cyclicals," - Dec 13, 2021"
59,S&P 500 Retreats as Cyclicals Slide on Omicron Worries," - Dec 13, 2021"
60,S&P 500 Eyes Record as Tech Fuels Biggest Rally Since March," - Dec 07, 2021"
61,S&P 500 in Rally Mode as Bulls Pile Into Tech; Apple Hits Record," - Dec 07, 2021"
62,Investors React as U.S. Stocks Roar Past Powell’s Hawkish Pivot ," - Dec 07, 2021"
63,Wall Street Opens Sharply Higher as Omicron Fears Recede; Dow up 400 Pts," - Dec 07, 2021"
64,Goldman Sachs Has Bad News for Investors Rushing to Buy the Dip," - Dec 07, 2021"
65,Lacklustre trading thwarts London's tech IPO ambitions," - Dec 07, 2021"
66,"Dow Futures Rise 355 Pts; Omicron Fears Ease, Intel Soars"," - Dec 07, 2021"
67,Wall Street regains some ground with help from easing virus fears," - Dec 06, 2021"
68,U.S. stocks higher at close of trade; Dow Jones Industrial Average up 1.87%," - Dec 06, 2021"
69,"Stocks rally, dollar gains as Omicron fears ease"," - Dec 06, 2021"
70,S&P 500 Turns Negative as First U.S. Omicron Case Triggers Uncertainty," - Dec 01, 2021"
71,Wall Street Jumps at Open on Omicron Optimism; Dow up 240 Pts," - Dec 01, 2021"
72,Apple Shares in Sweet Spot as Traders Rush to Safety," - Dec 01, 2021"
73,Wall Street strategists see more gains in 2022: Reuters poll," - Dec 01, 2021"
74,"Dow Futures Rise 300 Pts; Bouncing Ahead of ADP, ISM Data"," - Dec 01, 2021"
75,Officials offer vaccine reassurance; WHO advises against travel bans," - Nov 30, 2021"
76,Wall St ends lower as taper acceleration worries pile onto virus angst," - Nov 30, 2021"
77,"Stocks, oil slide as Omicron worries push investors to safe havens"," - Nov 30, 2021"
78,U.S. stocks lower at close of trade; Dow Jones Industrial Average down 1.86%," - Nov 30, 2021"
79,Powell places faster bond-buying taper on Fed's Christmas table," - Nov 30, 2021"
80,Factbox-Wall Street analysts' 2022 outlook for S&P 500," - Nov 24, 2021"
81,Nasdaq ends lower for second day as Big Tech loses ground," - Nov 23, 2021"
82,"Wall Street shares mixed as traders position for rate hikes, oil jumps"," - Nov 23, 2021"
83,S&P 500 Ekes Out Gain After Cutting Losses as Tech Eases Off Lows," - Nov 23, 2021"
84,U.S. stocks mixed at close of trade; Dow Jones Industrial Average up 0.55%," - Nov 23, 2021"
85,Wall Street Opens Mixed as Biden Moves to Lower Oil Prices; Dow up 100 Pts," - Nov 23, 2021"
86,U.S. Futures Mixed; Nasdaq Underperforms After Powell Nomination," - Nov 23, 2021"
87,Marketmind: Mind the (Europe-U.S.) gap," - Nov 23, 2021"
88,"Nasdaq, S&P 500 end down after hitting record highs"," - Nov 22, 2021"
89,Powell's reappointment gives investors stability," - Nov 22, 2021"
90,"S&P 500 Flat as Energy, Financials Weigh"," - Nov 17, 2021"
91,"Wall Street Opens Lower on Weak Housing Data, Inflation Fears; Dow Down 40 Pts"," - Nov 17, 2021"
92,Factbox-Wall Street analysts' 2022 outlook for S&P 500," - Nov 17, 2021"
93,U.S. Futures Largely Flat; Target and Lowe's Earnings Impress," - Nov 17, 2021"
94,Perish the thought - stocks might fall :Mike Dolan," - Nov 17, 2021"
95,Column: Perish the thought - stocks might fall," - Nov 17, 2021"
96,Retail boost helps lift S&P 500," - Nov 16, 2021"
97,"Stocks, dollar swing upward on hopeful retail data"," - Nov 16, 2021"
98,U.S. stocks higher at close of trade; Dow Jones Industrial Average up 0.15%," - Nov 16, 2021"
99,"S&P 500 Closes Just Shy of Record High as Tech, Retailers Shine"," - Nov 16, 2021"
100,S&P 500 Closes Lower as Soaring Inflation Reins in Bullish Bets," - Nov 10, 2021"
101,U.S. stocks lower at close of trade; Dow Jones Industrial Average down 0.60%," - Nov 10, 2021"
102,S&P 500 Slips as Inflation-Fueled Spike in Yields Triggers Tech Wreck," - Nov 10, 2021"
103,"Wall Street Opens Lower, Spooked by Inflation Data; Dow Down 50 Pts"," - Nov 10, 2021"
104,Tesla Shares Fall for a Fourth Day After $200 Billion Wipeout," - Nov 10, 2021"
105,"Dow Futures Fall 95 Pts; Caution Ahead of CPI, Jobless Claims"," - Nov 10, 2021"
106,GE energy spinoff aims to capture interest in renewables," - Nov 10, 2021"
107,Column: Hedge funds' FX plays get crushed in red October," - Nov 10, 2021"
108,Marketmind: The inflation conundrum," - Nov 10, 2021"
109,"GE, an industrial conglomerate pioneer, to break up"," - Nov 10, 2021"
110,"Asian Stocks Up as Fed Announces Tapering, but “Patience” on Interest Rate Hikes"," - Nov 03, 2021"
111,Wall St record run rolls on after Fed unveils anticipated bond-buying 'taper'," - Nov 03, 2021"
112,"Fed sings the 'transitory' inflation refrain, unveils bond-buying 'taper'"," - Nov 03, 2021"
113,"FOMC: Time is here to taper bond buying, not to hike rates"," - Nov 03, 2021"
114,"Global equities peak, Treasuries climb after Fed affirms taper plan"," - Nov 03, 2021"
115,U.S. stocks higher at close of trade; Dow Jones Industrial Average up 0.29%," - Nov 03, 2021"
116,Wall Street Notches Records as Fed Lines Up Taper But Downplays Rate Hikes," - Nov 03, 2021"
117,"S&P 500 Hits Fresh Record as Fed Sets Up Taper, but Downplays Rate Hikes"," - Nov 03, 2021"
118,Ramping up rates: Emerging central banks feel inflation pain," - Nov 03, 2021"
119,Fed to Start Tapering Asset Buys by $15 Billion Later This Month," - Nov 03, 2021"
120,Nasdaq Hits Record as Big Tech Gains; Facebook Changes Name," - Oct 28, 2021"
121,"Cyclicals drag S&P 500 lower; Microsoft, Alphabet keep Nasdaq flat"," - Oct 27, 2021"
122,"Equities dip, U.S. yields fall on resurgence in U.S.-China tensions"," - Oct 27, 2021"
123,U.S. stocks mixed at close of trade; Dow Jones Industrial Average down 0.74%," - Oct 27, 2021"
124,"S&P 500 Stumbles as Cyclicals Slip, Tech Loses Steam"," - Oct 27, 2021"
125,"Apple, Amazon, Mastercard: 3 Things to Watch"," - Oct 27, 2021"
126,S&P 500 Edges Higher as Tech Reigns Supreme on Falling Bond Yields," - Oct 27, 2021"
127,Investors on board as U.S. oil majors dismiss wind and solar projects," - Oct 27, 2021"
128,The Margin Squeeze Bears Are Worrying About Has Yet to Happen," - Oct 27, 2021"
129,Analysis-The 1970s all over again? Stagflation debate splits Wall St," - Oct 27, 2021"
130,S&P 500 climbs to record closing high; IBM weighs on the Dow," - Oct 21, 2021"
131,U.S. stocks mixed at close of trade; Dow Jones Industrial Average down 0.02%," - Oct 21, 2021"
132,"S&P 500 Notches New All-Time High as Big Tech, Tesla Shine"," - Oct 21, 2021"
133,"Schlumberger, Honeywell, American Express: 3 Things to Watch"," - Oct 21, 2021"
134,S&P 500 Fights Back From Session Lows to Hit Record Highs," - Oct 21, 2021"
135,Factbox-How Fed policymaker investments stack up against each other," - Oct 21, 2021"
136,Blackstone's earnings more than double on strong asset sales," - Oct 21, 2021"
137,"Wall Street Opens Mixed, Muted Impact from Jobless Claims; Dow Down 100 Pts"," - Oct 21, 2021"
138,"Tesla, AT&T Earnings, Jobless Claims, Return of Lockdown -What's Moving Markets"," - Oct 21, 2021"
139,"U.S. company results in industrial, materials sectors could shed light on inflation woes"," - Oct 21, 2021"
140,Regional bank loan growth could hint at healthier supply chains," - Oct 16, 2021"
141,Wall St ends up with Goldman; Dow posts biggest weekly rise since June," - Oct 15, 2021"
142,"World stocks notch best day in 5 months; oil, govt bond yields up"," - Oct 15, 2021"
143,U.S. stocks higher at close of trade; Dow Jones Industrial Average up 1.09%," - Oct 15, 2021"
144,"S&P 500 in Second-Weekly Win as Bulls Feast on Bullish Earnings, Data"," - Oct 15, 2021"
145,"Gold Back in Mid-$1,700 Trenches, Albeit With Weekly Gain"," - Oct 15, 2021"
146,"Oil Bulls Win for 8th Week With Brent at $85; US, China Issues on Backburner"," - Oct 15, 2021"
147,S&P 500 Rallies as Surprise Consumer Strength Keeps Bulls Marching on," - Oct 15, 2021"
148,Wall Street banks set to profit again when Fed withdraws pandemic stimulus," - Oct 15, 2021"
149,"Take Five: China, FAANGs, Turkey and Christmas fears loom large"," - Oct 15, 2021"
150,S&P 500 ends lower after U.S. September jobs miss," - Oct 08, 2021"
151,Wall St Week Ahead: Energy price spike adds market risk as earnings arrive," - Oct 08, 2021"
152,"Yields rise, stocks waver after U.S. jobs data"," - Oct 08, 2021"
153,U.S. stocks lower at close of trade; Dow Jones Industrial Average down 0.03%," - Oct 08, 2021"
154,S&P 500 Ends Week Higher as Jobs Miss Fails to Dent Optimism," - Oct 08, 2021"
155,S&P 500 Struggles for Direction on Bets Jobs Miss Unlikely to Delay Fed Taper," - Oct 08, 2021"
156,Fed closes in on November bond taper after jobs report," - Oct 08, 2021"
157,"Wall Street Opens Slightly Higher on 2nd Straight Jobs Miss; Dow Flat, S&P up 0.2%"," - Oct 08, 2021"
158,U.S. Futures Edge Higher; Caution Ahead of Payrolls," - Oct 08, 2021"
159,"Take Five: Inflation, energy and earnings"," - Oct 08, 2021"
160,Dow Futures Fall 110 Pts; Tesla Shines After 3Q Deliveries," - Oct 04, 2021"
161,"Asian Stocks Down, but Cautious Hope for Economic Growth Pickup Remains"," - Oct 03, 2021"
162,Bruised market eyes Treasury yields to gauge stocks' path," - Oct 03, 2021"
163,Las Vegas Sands Could be Sinking," - Oct 03, 2021"
164,Bruised market eyes Treasury yields to gauge stocks' path," - Oct 01, 2021"
165,"Wall Street kicks off October with broad rally, boosted by economic cheer"," - Oct 01, 2021"
166,Stocks bounce but inflation fears persist," - Oct 01, 2021"
167,Take Five: U.S. jobs & an OPEC oil gathering," - Oct 01, 2021"
168,U.S. stocks higher at close of trade; Dow Jones Industrial Average up 1.43%," - Oct 01, 2021"
169,S&P 500 Makes Strong Start to October as Merck Covid Pill Lifts Sentiment," - Oct 01, 2021"
170,"Tech pulls Nasdaq, S&P 500 down as Treasury yields rise"," - Sep 27, 2021"
171,S&P 500 Makes Sluggish Start to Week as Rallying Yields Weigh on Tech," - Sep 27, 2021"
172,Rising Treasury yields hit tech stocks; oil at 3-year highs," - Sep 27, 2021"
173,"S&P 500 Slips as Tech Stumble Offsets Surge in Energy, Financials"," - Sep 27, 2021"
174,"Micron Report, Confidence, Home Prices: 3 Things to Watch"," - Sep 27, 2021"
175,European shares end lower; German stocks rise on election relief," - Sep 27, 2021"
176,"Wall Street Opens Mixed, Hurt by Bond Yield Rise; Dow up 190 Pts, Nasdaq Down"," - Sep 27, 2021"
177,Costco Continues to Beat S&P 500," - Sep 26, 2021"
178,Nike: Growth Company with Big Market Opportunity," - Sep 26, 2021"
179,"Dow, S&P 500 end with gains up after bumpy week, but Nike drags"," - Sep 24, 2021"
180,"FedEx: Squeezed by Labor Shortages, Supply Chain Disruptions"," - Sep 22, 2021"
181,Supply Chain Challenges Taper Homebuilder Growth," - Sep 22, 2021"
182,Wall Street Opens Higher Ahead of Fed on China Relief; Dow up 200 Pts," - Sep 22, 2021"
183,Wall Street ends near flat on cautious note ahead of Fed," - Sep 21, 2021"
184,Stocks steady as markets calm after Evergrande-led slide," - Sep 21, 2021"
185,U.S. stocks mixed at close of trade; Dow Jones Industrial Average down 0.15%," - Sep 21, 2021"
186,S&P 500 Ends Lower as China-led Global Growth Worries Persist; Fed Eyed," - Sep 21, 2021"
187,"General Mills, KB Home, FOMC Statement: 3 Things to Watch"," - Sep 21, 2021"
188,S&P 500 Rebound Fades on Global Growth Concerns Ahead of Fed Meeting," - Sep 21, 2021"
189,"Microsoft Stock: Rising Free Cash Flows, Bullish Outlook"," - Sep 21, 2021"
190,"S&P 500 Closes Down, but Above Lows Despite Fresh Worries of Fed Tightening"," - Sep 16, 2021"
191,Caterpillar Stock: A Rock-Solid Dividend Growth Pick," - Sep 16, 2021"
192,"S&P 500 Off Session Lows, but Surprise Rise in Retail Sales Stokes Fed Fears"," - Sep 16, 2021"
193,Renesola Ltd. Could Rebound Strong," - Sep 16, 2021"
194,Fed's Powell orders sweeping ethics review after officials' trading prompts outcry," - Sep 16, 2021"
195,Wall Street Opens Mixed on Surprise Retail Sales Bump; Dow Down 170," - Sep 16, 2021"
196,"U.S. Futures Edge Lower; Retail Sales, Jobless Claims in Focus"," - Sep 16, 2021"
197,"Wall Street gains as crude price surge, strong economic data prompt broad rally"," - Sep 15, 2021"
198,"Global shares edge higher on Wall Street strength, crude price surge"," - Sep 15, 2021"
199,S&P 500 Snaps Losing Streak as Energy Boost Coaxes Bulls From Hiding," - Sep 15, 2021"
200,Wall Street's subdued finish fails to detract from strong August (Aug 31)," - Sep 09, 2021"
201,Analysis-Stimulus-pumped stocks at risk as warning signals flash red," - Sep 09, 2021"
202,Wall Street Opens a Touch Higher as Low Claims Ease Slowdown Fears; Dow up 50 Pts," - Sep 09, 2021"
203,"Marketmind: Over to you, Christine"," - Sep 09, 2021"
204,"Wall Street ends lower, weighed down by Big Tech"," - Sep 08, 2021"
205,Taro Pharmaceutical Outlines Path to Growth," - Sep 08, 2021"
206,"Worries over economic recovery shake world stocks, dollar pares gains"," - Sep 08, 2021"
207,U.S. stocks lower at close of trade; Dow Jones Industrial Average down 0.20%," - Sep 08, 2021"
208,Pre-ECB jitters knock 1% off European stocks," - Sep 08, 2021"
209,Wall Street Opens Mostly Lower as Economic Fears Weigh Again; Dow Down 65 Pts," - Sep 08, 2021"
210,S&P 500 Slips From Record Highs as Stocks Struggle for Direction," - Aug 31, 2021"
211,Wall Street Opens Lower as House Price Rise Revives Taper Fears; Dow Down 35 Pts," - Aug 31, 2021"
212,U.S. Futures Edge Lower; Zoom Slumps on Revenue Outlook," - Aug 31, 2021"
213,"U.S. out of Afghanistan, Zoom Tumbles, China Economy Slows - What's Moving Markets"," - Aug 31, 2021"
214,Marketmind: Who's rocking the boat now?," - Aug 31, 2021"
215,"S&P, Nasdaq post record closes on dovish Fed taper-talk"," - Aug 30, 2021"
216,U.S. stocks end at record highs as oil prices gain," - Aug 30, 2021"
217,U.S. stocks mixed at close of trade; Dow Jones Industrial Average down 0.16%," - Aug 30, 2021"
218,"Zoom Video, Crowdstrike, Consumer Confidence: 3 Things to Watch"," - Aug 30, 2021"
219,Wall Street Opens Mixed as Eyes Turn to Jobs Report; Dow Down 15 Pts," - Aug 30, 2021"
220,Wall Street Opens Mixed as Calm Descends Ahead of Fed; Dow Down 50 Pts," - Aug 25, 2021"
221,"Wall Street's pandemic rally to sputter, strategists warn - Reuters poll"," - Aug 25, 2021"
222,U.S. Futures Edge Higher; Nordstrom Slumps on Revenue Drop," - Aug 25, 2021"
223,"Fed Tapering, Democrat Spending, German Business Woes - What's Moving Markets"," - Aug 25, 2021"
224,European Stocks Edge Higher; German Ifo Falls More Than Expected," - Aug 25, 2021"
225,"European Stock Futures Largely Flat Ahead of Ifo, Jackson Hole Meeting"," - Aug 25, 2021"
226,"Asian Stocks Up, Boosted by Commodity Rally, Record Finish in U.S."," - Aug 24, 2021"
227,"Meme stocks soar in late day trading surge, short sellers knocked"," - Aug 24, 2021"
228,"Wall St extends rally, pushing S&P 500 to 50th all-time high close this year"," - Aug 24, 2021"
229,"Stocks, U.S. yields gain ahead of Fed chair Powell's Jackson Hole speech"," - Aug 24, 2021"
230,"Wall Street slumps after weak retail sales, Home Depot results"," - Aug 17, 2021"
231,S&P 500 Snaps 5-Day Streak as Retail Sales Flag Consumer Worries," - Aug 17, 2021"
232,Stocks and oil slide as Delta's spread muddies economic picture," - Aug 17, 2021"
233,U.S. stocks lower at close of trade; Dow Jones Industrial Average down 0.79%," - Aug 17, 2021"
234,S&P 500 Slumps as Worries Over Consumer Grow After Retail Sales Slide," - Aug 17, 2021"
235,"Analysis: As investors look to Jackson Hole, options markets see 'a lot of nothing'"," - Aug 17, 2021"
236,Wall Street Opens Lower After Retail Sales Miss; Dow Down 270 Pts," - Aug 17, 2021"
237,Dow Futures 195 Points Lower; Home Depot Disappoints," - Aug 17, 2021"
238,"S&P 500, Dow hit record highs as defensive shares shine"," - Aug 16, 2021"
239,Investors scratch out stock gains while weighing covid concerns," - Aug 16, 2021"
240,"Stocks strengthen; yields, dollar rise on Fed taper talk"," - Aug 10, 2021"
241,U.S. stocks mixed at close of trade; Dow Jones Industrial Average up 0.46%," - Aug 10, 2021"
242,Pfizer shares hit record high with COVID-19 vaccine stocks on a tear," - Aug 10, 2021"
243,"S&P 500, Dow Close at Records as Bulls Cheer Progress on Infrastructure Bill"," - Aug 10, 2021"
244,"S&P 500, Dow in Record Run as Infrastructure Bill Clears Senate"," - Aug 10, 2021"
245,"S&P dips, just off record as energy shares fall"," - Aug 09, 2021"
246,"S&P 500 Stutters as Energy Slumps, But Financials Keep Losses in Check"," - Aug 09, 2021"
247,U.S. stocks mixed at close of trade; Dow Jones Industrial Average down 0.30%," - Aug 09, 2021"
248,"Stocks tread water as gold, oil declines spook sentiment"," - Aug 09, 2021"
249,S&P 500 Slips on Energy But Still Trades Near Record High," - Aug 09, 2021"
250,Wall Street Edges Higher at Open Despite Growth Jitters; Dow Flat," - Aug 03, 2021"
251,UK takeovers hit 14-year high in first seven months of 2021," - Aug 03, 2021"
252,U.S. company profits even bigger than Wall Street's lofty targets," - Aug 03, 2021"
253,"S&P 500 edges down on virus woes, slowing economy"," - Aug 02, 2021"
254,"Stocks reverse to red, oil slips amid Delta variant anxiety"," - Aug 02, 2021"
255,U.S. stocks mixed at close of trade; Dow Jones Industrial Average down 0.28%," - Aug 02, 2021"
256,"Dow Loses Steam Into Close as Rising Cases, Weaker Economic Data Weigh"," - Aug 02, 2021"
257,"Lilly, Marriott, Lyft Earnings: 3 Things to Watch"," - Aug 02, 2021"
258,Dow Eases From Record as Stocks Struggle for Direction," - Aug 02, 2021"
259,U.S. manufacturing growth cooling; bottlenecks starting to abate," - Aug 02, 2021"
260,Energy & Precious Metals - Weekly Review and Calendar Ahead," - Jul 25, 2021"
261,Top 5 Things to Watch in Markets in the Week Ahead," - Jul 25, 2021"
262,"Wall Street surges to all-time closing high on earnings, economic revival"," - Jul 23, 2021"
263,Big tech companies retake market reins with earnings on tap," - Jul 23, 2021"
264,"U.S. stock markets hit new highs, Treasury yields up as choppy week ends"," - Jul 23, 2021"
265,U.S. stocks higher at close of trade; Dow Jones Industrial Average up 0.68%," - Jul 23, 2021"
266,"Dow Closes Above 35,000 for First Time as Strong Earnings Stoke Bullish Bets"," - Jul 23, 2021"
267,"Snug in $1,800 Zone And Barely Moving, Gold Posts First Weekly Loss in 5"," - Jul 23, 2021"
268,"S&P 500 Hits Fresh Record as Twitter, Snap Rally"," - Jul 23, 2021"
269,Take Five: The great Fed conundrum," - Jul 23, 2021"
270,Covid-19 Fears Spark Early Wall Street Sell-Off; Dow Down 450 Pts," - Jul 19, 2021"
271,"Asian Stocks Down Over Continual “Bad News” on the COVID-19, Inflation Fronts"," - Jul 18, 2021"
272,U.S. small caps waver as reflation trade wobbles," - Jul 16, 2021"
273,Wall Street ends down as Delta variant drives fears," - Jul 16, 2021"
274,"Stocks slide, bond yields dip as inflation worries linger"," - Jul 16, 2021"
275,U.S. stocks lower at close of trade; Dow Jones Industrial Average down 0.86%," - Jul 16, 2021"
276,S&P 500 Snaps 3-Week Win Streak Despite Upbeat Start to Earnings Season," - Jul 16, 2021"
277,S&P 500 Falls as Bulls in Hiding Despite Signs of Strong Consumer," - Jul 16, 2021"
278,Wall Street Opens Higher; Moderna Shines After S&P 500 Inclusion; Dow up 30 Pts," - Jul 16, 2021"
279,Exclusive-Louis Vuitton-backed L Catterton explores public listing -sources," - Jul 16, 2021"
280,Wall Street posts record closing highs as financials lead rebound," - Jul 09, 2021"
281,"Treasury yields rise, U.S. stocks hit new highs; dollar weakens"," - Jul 09, 2021"
282,U.S. stocks higher at close of trade; Dow Jones Industrial Average up 1.30%," - Jul 09, 2021"
283,S&P 500 Hits Record as Banks Ride Rising Yields Higher Ahead of Earnings," - Jul 09, 2021"
284,S&P 500 Hits Fresh Record as Bond Yields Steady," - Jul 09, 2021"
285,Wall Street Opens Higher as Bond Market Tightness Unwinds; Dow up 240 Pts," - Jul 09, 2021"
286,Value Trade Is Just Getting Started Beyond the U.S. Stock Market," - Jul 09, 2021"
287,"Take Five: Bond bulls, China's conundrums and U.S. earnings"," - Jul 09, 2021"
288,Dow Futures 220 Pts Higher; Big Tech in Focus as Biden Revives Net Neutrality," - Jul 09, 2021"
289,Slide in coronavirus-sensitive stocks suggests growing worries over Delta variant," - Jul 09, 2021"
290,"Asian Stocks Mixed, Focus Now Squarely on U.S. Jobs Report for June"," - Jul 01, 2021"
291,S&P 500 winning streak extends to sixth straight record close," - Jul 01, 2021"
292,Stocks reach for records as U.S. jobless claims dive," - Jul 01, 2021"
