,Article Titles,Date
2374,U.S. stocks mixed at close of trade; Dow Jones Industrial Average up 0.18%," - Jan 26, 2017"
2375,U.S. stocks struggle near record highs amid earnings deluge," - Jan 26, 2017"
2376,Wall Street ends higher as Trump becomes president," - Jan 20, 2017"
2377,U.S. stocks close higher with Trump administration underway," - Jan 20, 2017"
2378,U.S. stocks higher at close of trade; Dow Jones Industrial Average up 0.48%," - Jan 20, 2017"
2379,U.S. stocks rise ahead of words from President Trump," - Jan 20, 2017"
2380,"For stock performance under Trump, don't look to prior transitions"," - Jan 20, 2017"
2381,Investors curb their enthusiasm ahead of Trump era," - Jan 19, 2017"
2382,U.S. stocks lower at close of trade; Dow Jones Industrial Average down 0.33%," - Jan 19, 2017"
2383,U.S. stocks lower with caution ahead of inauguration," - Jan 19, 2017"
2384,Wall St. slips as countdown to Trump's swearing-in begins," - Jan 19, 2017"
2385,"U.S. investors see more automation, not jobs, under Trump administration"," - Jan 19, 2017"
2386,Wall St edges higher as Trump due to speak   ," - Jan 11, 2017"
2387,"U.S. stocks, dollar gain as investors await Trump message"," - Jan 11, 2017"
2388,"Shares in Asia mixed as attention turns to Trump, Toshiba gains"," - Jan 10, 2017"
2389,U.S. stocks mixed at close of trade; Dow Jones Industrial Average down 0.16%," - Jan 10, 2017"
2390,Stock markets mixed on Tuesday," - Jan 10, 2017"
2391,Nasdaq hits record high; IBM weighs on Dow," - Jan 10, 2017"
2392,U.S. stocks bounce back as investors exit crude," - Jan 10, 2017"
2393,Wall St flat in subdued trade   ," - Jan 10, 2017"
2394, U.S. job openings rise less than expected in November," - Jan 10, 2017"
2395, U.S. stock futures on pause ahead of key events," - Jan 10, 2017"
2396,"Dollar, oil and stocks look to end year with gains"," - Dec 30, 2016"
2397,Four major market indexes down on Friday," - Dec 30, 2016"
2398,Wall St. thinks stocks will rise in 2017 - What could go wrong?," - Dec 30, 2016"
2399,Chicago PMI falls more than expected in December," - Dec 30, 2016"
2400,U.S. stock futures point to positive end for 2016," - Dec 30, 2016"
2401,Top 5 Things to Know In the Market on Friday," - Dec 30, 2016"
2402,Wall St. edges lower as bank shares fall," - Dec 29, 2016"
2403,U.S. stocks lower at close of trade; Dow Jones Industrial Average down 0.02%," - Dec 29, 2016"
2404,Stock market indexes drop on Thursday," - Dec 29, 2016"
2405,U.S. stocks slip while crude undergoes volatility after inventory build," - Dec 29, 2016"
2406,U.S. existing home sales unexpectedly rise in November ," - Dec 21, 2016"
2407,Legal pot growers to drive up California warehouse rates," - Dec 21, 2016"
2408,U.S. stocks higher at close of trade; Dow Jones Industrial Average up 0.46%," - Dec 20, 2016"
2409,"Wall Street rises as Dow, Nasdaq set records"," - Dec 20, 2016"
2410,"Dow sets 17th record close since election, eyes 20,000.00 mark"," - Dec 20, 2016"
2411,"Wall St higher, DJI just shy of 20,000   "," - Dec 20, 2016"
2412,"Shares in Asia mixed in subdued trade, Tokyo, Sydney gain"," - Dec 20, 2016"
2413,U.S. stocks higher at close of trade; Dow Jones Industrial Average up 0.20%," - Dec 19, 2016"
2414,Wall Street extends rally but Germany truck deaths reduce gains," - Dec 19, 2016"
2415,"Dow closed higher Monday, powered by energy stocks"," - Dec 19, 2016"
2416,Gold settles higher on overall market optimism," - Dec 12, 2016"
2417,"Wall Street drifts lower as financial, tech stocks drag"," - Dec 12, 2016"
2418,Dow on track for 15th record closing high since elections," - Dec 12, 2016"
2419,Wall St mixed ahead of FOMC as oil jumps   ," - Dec 12, 2016"
2420,Asian shares mostly weaker after early gains on OPEC output deal," - Dec 11, 2016"
2421,Johnson & Johnson shares could rally about 20 percent: Barron's," - Dec 11, 2016"
2422,Federal bureaucrats seek to sabotage Trump energy policies through leaks," - Dec 10, 2016"
2423,Hawkish Fed a potential speed bump for stock bulls," - Dec 09, 2016"
2424,U.S. stocks higher at close of trade; Dow Jones Industrial Average up 0.72%," - Dec 09, 2016"
2425,Record-setting rally pushes on as laggards get legs," - Dec 09, 2016"
2426,U.S. stocks mixed at close of trade; Dow Jones Industrial Average down 0.11%," - Dec 02, 2016"
2427,Wall Street little changed as bank rally pauses," - Dec 02, 2016"
2428,DJIA closes down 11% on Friday," - Dec 02, 2016"
2429,Asian shares fall in cautious trade ahead of U.S. jobs," - Dec 01, 2016"
2430,"Brent at 16-month high, Treasury yields climb further"," - Dec 01, 2016"
2431,Climate change pushing U.S. fund managers out of apparel stocks," - Dec 01, 2016"
2432,U.S. stocks mixed at close of trade; Dow Jones Industrial Average up 0.25%," - Dec 01, 2016"
2433,Energy shares close higher on Wall Street," - Dec 01, 2016"
2434,U.S. stocks mixed as investors digest data and oil continues rally ," - Dec 01, 2016"
2435,"Wall St mixed as Dow gains, Nasdaq falls as oil rally extends   "," - Dec 01, 2016"
2436,Money Markets: Traders see U.S. rate hike as a sure thing in December," - Nov 23, 2016"
2437,"U.S. shares end at record highs for second day, oil steadies"," - Nov 22, 2016"
2438,U.S. stocks higher at close of trade; Dow Jones Industrial Average up 0.35%," - Nov 22, 2016"
2439,U.S. stocks run out of steam near record highs as OPEC deal hopes fade," - Nov 22, 2016"
2440,"Wall Street hits record highs, dollar gains vs. yen"," - Nov 22, 2016"
2441,"Wall St Trump rally continues as DJI breaches 19,000 points   "," - Nov 22, 2016"
2442, U.S. existing home sales unexpectedly jump in October ," - Nov 22, 2016"
2443,Top 5 Things to Know In the Market on Tuesday," - Nov 22, 2016"
2444,Major indexes hit records as post-election rally goes on," - Nov 21, 2016"
2445,U.S. stocks higher at close of trade; Dow Jones Industrial Average up 0.47%," - Nov 21, 2016"
2446,Big-name investors remained bearish on financials before U.S. election," - Nov 14, 2016"
2447,REITs turn around - head sharply higher," - Nov 14, 2016"
2448,U.S. stocks run out of steam with profit-taking amid lack of references," - Nov 14, 2016"
2449,Selloff in utilities continues," - Nov 14, 2016"
2450,Tech continues to lag; Facebook falls another 4%," - Nov 14, 2016"
2451,Wall St mixed after bond sell-off; Dow hits record on banks   ," - Nov 14, 2016"
2452,U.S. stock futures point to mixed open as global yields surge," - Nov 14, 2016"
2453,Top 5 Things to Know in the Market on Monday," - Nov 14, 2016"
2454,'Trump Thump' whacks bond market for $1 trillion loss," - Nov 14, 2016"
2455,Dollar soars as U.S. yields spike; global shares divided," - Nov 14, 2016"
2456,Wall Street gains as traders bet on Clinton victory," - Nov 08, 2016"
2457,"Deutsche neutral on mid-cap bank sector, but likes a few"," - Nov 08, 2016"
2458,U.S. stocks move higher with voting in full-swing," - Nov 08, 2016"
2459,"Stocks, dollar hemmed in ahead of U.S. election results"," - Nov 08, 2016"
2460,Wall St lower ahead of U.S. election result   ," - Nov 08, 2016"
2461,"Banks, brokers gird for Brexit-style tumult following Tuesday's election"," - Nov 08, 2016"
2462, U.S. job openings rise less than expected in September," - Nov 08, 2016"
2463,Shares in Asia narrowly mixed with Shanghai up after trade figures," - Nov 07, 2016"
2464,U.S. stocks higher at close of trade; Dow Jones Industrial Average up 2.08%," - Nov 07, 2016"
2465,Wall Street soars as investors see higher chance of Clinton win," - Nov 07, 2016"
2466,"M&A flurry lifts S&P, Nasdaq; Nike drags Dow"," - Oct 31, 2016"
2467,"Dollar rebounds after Clinton probe shock, global stocks steady"," - Oct 31, 2016"
2468,U.S. stocks slightly higher with investors cautious ahead of busy week," - Oct 31, 2016"
2469,Wall St edges up after M&A deals; Clinton email probe jitters   ," - Oct 31, 2016"
2470,"Chicago PMI hits 5-month low in October, missing estimates"," - Oct 31, 2016"
2471,"U.S. futures cautious ahead of Fed decision, jobs report and election"," - Oct 31, 2016"
2472,"Shares in Asia mixed on caution as Fed, U.S. election eyed"," - Oct 30, 2016"
2473,U.S. stocks lower at close of trade; Dow Jones Industrial Average down 0.05%," - Oct 28, 2016"
2474,"Wall St. rises amid robust GDP data, mixed earnings"," - Oct 28, 2016"
2475,"GDP strongest in two years; stocks hold small gains, bond prices dip"," - Oct 28, 2016"
2476,"PayPal's shares rally on revenue beat, margin forecast"," - Oct 20, 2016"
2477,Wall Street dips as telecoms slump; AmEx surges," - Oct 20, 2016"
2478,U.S. stocks lower at close of trade; Dow Jones Industrial Average down 0.22%," - Oct 20, 2016"
2479,Investors pull 1 percent of hedge fund capital in third quarter: data," - Oct 20, 2016"
2480," U.S. stocks trade lower on mixed earnings, data; oil plunges 2%"," - Oct 20, 2016"
2481,"Wall St mixed after earnings, data; oil retreats   "," - Oct 20, 2016"
2482,Global stocks nudge higher after final U.S. presidential debate," - Oct 20, 2016"
2483,Shares in Asia mixed with Sydney up after shrugging off jobs data," - Oct 19, 2016"
2484,"Some hedge funds post mega-gains, brighten industry gloom"," - Oct 19, 2016"
2485,U.S. stocks higher at close of trade; Dow Jones Industrial Average up 0.22%," - Oct 19, 2016"
2486,"Wall Street sells off amid weak earnings, election jitters"," - Oct 11, 2016"
2487,"Dollar hits 11-week high, oil prices slump"," - Oct 11, 2016"
2488,"U.S. stocks drop on sour start to earnings season, Dow down 100 points"," - Oct 11, 2016"
2489,Alcoa plunges 5% in Q3 earnings season kick off," - Oct 11, 2016"
2490, U.S. stock futures move lower as Q3 earnings season kicks off," - Oct 11, 2016"
2491,Top 5 Things to Know in the Market on Tuesday," - Oct 11, 2016"
2492,Shares in Asia gain as China Q3 economy figures seen promising," - Oct 10, 2016"
2493,Wall Street gains with energy shares; Apple up on Samsung woes," - Oct 10, 2016"
2494,U.S. stocks higher at close of trade; Dow Jones Industrial Average up 0.49%," - Oct 10, 2016"
2495,Apple stock hits highest since December on Samsung Note 7 fire crisis," - Oct 10, 2016"
2496,Chicago PMI rises more than expected in September," - Sep 30, 2016"
2497,"Global M&A drops in third quarter, companies wary of overpaying"," - Sep 30, 2016"
2498,Shares in Asia mixed as China heads for long holiday next week ," - Sep 29, 2016"
2499,DoubleLine's Gundlach: avoid Deutsche Bank securities for now," - Sep 29, 2016"
2500,Video game makers extend months-long rally with new titles on tap," - Sep 29, 2016"
2501,Wall Street falls sharply on worries about banks," - Sep 29, 2016"
2502,U.S. stocks lower at close of trade; Dow Jones Industrial Average down 1.07%," - Sep 29, 2016"
2503,Push to digital helps Accenture beat revenue estimate," - Sep 29, 2016"
2504,"Oil gains, energy shares buoy global stocks; yen slides"," - Sep 29, 2016"
2505,Largest hedge funds bleed assets: survey," - Sep 29, 2016"
2506,Wall Street rallies after Fed stands pat on rates," - Sep 21, 2016"
2507,U.S. stocks higher at close of trade; Dow Jones Industrial Average up 0.90%," - Sep 21, 2016"
2508,U.S. stocks wait for Fed with gains after oil inventories and BoJ," - Sep 21, 2016"
2509,"Global stocks gain, dollar falls after BOJ; eyes on Fed"," - Sep 21, 2016"
2510,Wall St higher as FOMC outcome awaits   ," - Sep 21, 2016"
2511,Shares in Tokyo gain as Bank of Japan unveils new policy effort," - Sep 21, 2016"
2512,"Wall Street ends flat with Fed, BOJ up next"," - Sep 20, 2016"
2513,U.S. stocks higher at close of trade; Dow Jones Industrial Average up 0.05%," - Sep 20, 2016"
2514,"U.S. stocks off intraday highs amid housing data, Fed and BoJ caution"," - Sep 20, 2016"
2515,Wall St higher as Fed seen holding on rates   ," - Sep 20, 2016"
2516,"Wall St. drops amid worries over North Korea test, rate outlook"," - Sep 09, 2016"
2517,U.S. stocks lower at close of trade; Dow Jones Industrial Average down 2.13%," - Sep 09, 2016"
2518,The ugly unloved attractions of natural resource shares: James Saft," - Sep 09, 2016"
2519,"German jitters weigh on stocks, ECB doubts lift yields"," - Sep 09, 2016"
2520,"Shares in Asia mixed, Shanghai down marginally at the break after CPI"," - Sep 09, 2016"
2521,Fed may surprise market with rate hike: DoubleLine's Gundlach," - Sep 08, 2016"
2522,Apple weighs on Wall St; energy shares a boost," - Sep 08, 2016"
2523,U.S. stocks lower at close of trade; Dow Jones Industrial Average down 0.25%," - Sep 08, 2016"
2524,Wall St lower as ECB’s Draghi disappoints   ," - Sep 08, 2016"
2525,"Shares in Asia down despite mildly upbeat regional trade data, Japan GDP"," - Sep 07, 2016"
2526,Shares in Asia mixed with Shanghai down ahead of PMI data this week," - Aug 30, 2016"
2527,U.S. stocks lower at close of trade; Dow Jones Industrial Average down 0.26%," - Aug 30, 2016"
2528,"Kiss it goodbye, the great buyback boom is on the wane: James Saft"," - Aug 30, 2016"
2529,Wall Street falls as Apple drags down tech stocks," - Aug 30, 2016"
2530,"U.S. stocks lower on Apple, Hershey malaise despite consumer confidence"," - Aug 30, 2016"
2531,Wall St edges lower as market seeks more Fed rate input   ," - Aug 30, 2016"
2532,U.S. CB consumer confidence rises to 11-month high in August," - Aug 30, 2016"
2533,Shares in Asia gain on regional data flows in cautious trade on Fed view," - Aug 29, 2016"
2534,Heed the warning label on mutual funds - passive is better," - Aug 29, 2016"
2535,U.S. SEC fines 13 advisers for false claims involving F-Squared," - Aug 29, 2016"
2536,Investing.com sentiment index: speculators stay bearish on pound," - Aug 22, 2016"
2537,Focus on VIX futures shorts hides the real story," - Aug 22, 2016"
2538,Shares in Asia mostly down with Tokyo up on weaker yen," - Aug 21, 2016"
2539,Stock rotation to continue as Fed seen open to 2016 hike," - Aug 20, 2016"
2540,U.S. stocks flat as NASDAQ completes 8th straight week of positive gains," - Aug 19, 2016"
2541,Wall St. dips as investors assess rate outlook," - Aug 19, 2016"
2542,Global stocks fall in light trading as dollar rises on Fed hike bets," - Aug 19, 2016"
2543,U.S. stocks lower at close of trade; Dow Jones Industrial Average down 0.24%," - Aug 19, 2016"
2544,Pricey U.S. stock valuations may warrant second look," - Aug 19, 2016"
2545,U.S. stocks mixed as markets hold their breath for Yellen," - Aug 19, 2016"
2546, U.S. consumer sentiment rises less than expected in August," - Aug 12, 2016"
2547,"Emerging markets in 'melt up', cash returns to global stocks: BAML"," - Aug 12, 2016"
2548,"Shares in Asia mixed with Shanghai down on industrial, retail data"," - Aug 11, 2016"
2549,"Crude fuels gains on Wall Street, as all 3 indices close at record-highs"," - Aug 11, 2016"
2550,Wall St. hits record highs as investors buy department stores," - Aug 11, 2016"
2551,U.S. stocks higher at close of trade; Dow Jones Industrial Average up 0.64%," - Aug 11, 2016"
2552,Legg Mason's Bill Miller leaves firm amid faded glory," - Aug 11, 2016"
2553,U.S. stocks gain on department store earnings while oil jumps 3%," - Aug 11, 2016"
2554,Shares in Asia fall slightly as investors trade in narrow range," - Aug 10, 2016"
2555,"Column: Your active manager: better, cheaper, less successful - James Saft"," - Aug 10, 2016"
2556,"U.S. factory orders fell 1.5% in June, still beat forecasts"," - Aug 04, 2016"
2557,BlackRock's voting record clashes with CEO's tough talk on buybacks," - Aug 04, 2016"
2558,'A perfect storm' is making gold one of the hottest assets on the planet," - Aug 04, 2016"
2559,"BoE rate call looms, Asian shares firm as oil rebounds for now"," - Aug 03, 2016"
2560,"Big tech may halt earnings recession, if it delivers third-quarter numbers"," - Aug 03, 2016"
2561,"U.S. stocks post slight gains, as Dow halts seven-day losing streak"," - Aug 03, 2016"
2562,U.S. stocks higher at close of trade; Dow Jones Industrial Average up 0.23%," - Aug 03, 2016"
2563,"Energy, financial stocks give Wall St. modest lift"," - Aug 03, 2016"
2564,U.S. stocks higher at close of trade; Dow Jones Industrial Average up 0.15%," - Aug 03, 2016"
2565,U.S. stocks slightly higher on mixed data as WTI oil recovers $40," - Aug 03, 2016"
2566,U.S. stock index futures higher as more earnings await   ," - Jul 27, 2016"
2567,"Asian shares mixed as markets await Fed views, Tokyo gains"," - Jul 26, 2016"
2568,U.S. stocks mixed at close of trade; Dow Jones Industrial Average down 0.10%," - Jul 26, 2016"
2569,"U.S. stocks mixed, as investors brace for subdued Apple earnings"," - Jul 26, 2016"
2570,U.S. stocks lower amid slew of earnings and data while waiting for Fed," - Jul 26, 2016"
2571,U.S. CB consumer confidence falls to 97.3 in July ," - Jul 26, 2016"
2572,U.S. new home sales rise more than expected in June," - Jul 26, 2016"
2573,U.S. Markit services PMI unexpectedly fell in July; missing forecasts," - Jul 26, 2016"
2574,"U.S. stock futures struggle for direction ahead of earnings, Fed"," - Jul 26, 2016"
2575,Asian shares mixed with Tokyo down on stimulus plan reports," - Jul 25, 2016"
2576,Wall St lower as Netflix weighs on tech stocks   ," - Jul 19, 2016"
2577,U.S. housing starts rise in June; momentum slowing," - Jul 19, 2016"
2578,"Asian shares mixed with investors eyeing monetary policy, Tokyo up"," - Jul 18, 2016"
2579,Goldman asset management executive Gottlieb to leave firm," - Jul 18, 2016"
2580,"Wall St. sets records again, led by tech, bank stocks"," - Jul 18, 2016"
2581,U.S. stocks higher at close of trade; Dow Jones Industrial Average up 0.09%," - Jul 18, 2016"
2582,U.S. stocks higher amid company earnings while oil slumps 2%," - Jul 18, 2016"
2583,Wall St push higher after failed Turkish coup   ," - Jul 18, 2016"
2584,Investing.com sentiment index: speculators add to bearish pound bets," - Jul 18, 2016"
2585,"U.S. futures higher as failed coup in Turkey calms nerves, BofA beats"," - Jul 18, 2016"
2586,"Gold plunges in broad risk-on trade, as Dow hits all-time high"," - Jul 12, 2016"
2587,"U.S. stocks continue to rally on positive Q2 earnings, oil surges 4%"," - Jul 12, 2016"
2588,Wall St opens at fresh highs as rally continues   ," - Jul 12, 2016"
2589,U.S. job openings fall more than expected in May," - Jul 12, 2016"
2590,Gold slides 1% as global stock market rally dampens demand," - Jul 12, 2016"
2591,Silver sparkles as commodities outperform other assets   ," - Jul 12, 2016"
2592,U.S stock index futures up as global rally continues   ," - Jul 12, 2016"
2593,Top 5 Things to Know In the Market on Tuesday," - Jul 12, 2016"
2594,Global shares gain as Brexit tensions ease amid stimulus hopes," - Jul 12, 2016"
2595,Shares in Asia gain led by Tokyo as stimulus plans aid sentiment," - Jul 11, 2016"
2596,"U.S. ISM services PMI soars in June, blowing past consensus"," - Jul 06, 2016"
2597,"U.S. futures follow Asia, Europe lower as Brexit fears grip   "," - Jul 06, 2016"
2598,"Asian shares slump on strong yen, weak pound and downbeat sentiment"," - Jul 05, 2016"
2599,"U.S. stocks fall sharply, as U.S. 10-year yields fall to record-lows"," - Jul 05, 2016"
2600,U.S. stocks lower at close of trade; Dow Jones Industrial Average down 0.61%," - Jul 05, 2016"
2601,"Wall St. falls as Brexit uncertainty, oil weigh"," - Jul 05, 2016"
2602,Wall St lower in early trade as investors seek safe-haven assets   ," - Jul 05, 2016"
2603," U.S. stocks fall in broad-based flight to safety, oil plummets 4%"," - Jul 05, 2016"
2604,U.S stock futures lower as global economy worries re-emerge   ," - Jul 05, 2016"
2605,Investing.com sentiment index: speculators reduce bearish pound bets," - Jul 04, 2016"
2606,U.S. futures bounce back after $3 trillion global stock rout," - Jun 28, 2016"
2607,Asian shares decline as investors focus on drawn-out Brexit process," - Jun 27, 2016"
2608,Wall Street sings Brexit blues with brutal two-day slide," - Jun 27, 2016"
2609,"U.S. stocks fall sharply erasing 2016 gains, as Brexit concerns fester"," - Jun 27, 2016"
2610,U.S. stocks lower at close of trade; Dow Jones Industrial Average down 1.50%," - Jun 27, 2016"
2611, U.S. stocks continue to tumble on Brexit; Yellen appearance canceled," - Jun 27, 2016"
2612,Wall Street opens sharply lower on Brexit hangover   ," - Jun 27, 2016"
2613,"S&P 500 falls below 2,000 for first time in 3 months"," - Jun 27, 2016"
2614,U.S. Markit services PMI remains unchanged in June; missing forecasts," - Jun 27, 2016"
2615,Line IPO range announcement delayed until Tuesday: filing," - Jun 27, 2016"
2616,Wall Street ends higher as Britain seen staying in EU," - Jun 20, 2016"
2617,"U.S. stocks pare sharp gains, as Brexit concerns continue to subside"," - Jun 20, 2016"
2618,U.S. stocks higher at close of trade; Dow Jones Industrial Average up 0.73%," - Jun 20, 2016"
2619,U.S. stocks rise 1% as Brexit fears recede; Dow jumps 200 points," - Jun 20, 2016"
2620,"Apple to lose weighting in Russell index, shares could fall"," - Jun 20, 2016"
2621,Investing.com sentiment index: speculators reduce bearish pound bets," - Jun 20, 2016"
2622,"Shares in Asia mostly higher on Brexit polls, Shanghai bucks trend"," - Jun 19, 2016"
2623,Heavy trading predicted around Brexit vote," - Jun 18, 2016"
2624,Wall St. ends week on down note as Apple weighs," - Jun 17, 2016"
2625,U.S. stocks lower at close of trade; Dow Jones Industrial Average down 0.33%," - Jun 17, 2016"
2626,"Stocks down, bonds rally as 'Brexit' vote looms"," - Jun 09, 2016"
2627,"U.S. stocks fall slightly as Dow, S&P 500 halt three-day winning streaks"," - Jun 09, 2016"
2628,U.S. stocks lower at close of trade; Dow Jones Industrial Average down 0.11%," - Jun 09, 2016"
2629,Wall Street falls back as oil drops," - Jun 09, 2016"
2630,U.S. household net worth rose to $88.1 trillion in first quarter: Fed," - Jun 09, 2016"
2631,U.S. stocks slip from record highs on bearish bets and global concern," - Jun 09, 2016"
2632,Weekly Comic: S&P 500 moves back towards record high territory," - Jun 09, 2016"
2633,"Markets may be too complacent over Brexit risk, BlackRock says"," - Jun 09, 2016"
2634,Top 5 Things to Know In the Market on Thursday," - Jun 09, 2016"
2635,"Faltering risk appetite hits stocks, sends Bund yields to record lows"," - Jun 09, 2016"
2636,"U.S. stocks rally late, ahead of critical June jobs report"," - Jun 02, 2016"
2637,U.S. stocks higher at close of trade; Dow Jones Industrial Average up 0.27%," - Jun 02, 2016"
2638,Activist Barington lays out demands in fight with Chico's," - Jun 02, 2016"
2639,U.S. stocks trade lower in an oil dominated session after OPEC inaction," - Jun 02, 2016"
2640,U.S. fund managers focus on niche retailers as consumer spending jumps," - Jun 02, 2016"
2641,"Shares in Asia mostly weaker with Tokyo down on Sato views, Shanghai up"," - Jun 01, 2016"
2642,Gundlach's DoubleLine reaches $100 billion in assets under management," - Jun 01, 2016"
2643,Wall St. notches minor gains as economic data pours in," - Jun 01, 2016"
2644,"U.S. stocks hold onto gains, amid modest growth in Fed's Beige Book"," - Jun 01, 2016"
2645,U.S. May auto sales down 6 percent; sedan sales weak," - Jun 01, 2016"
2646,"Asian shares gain on U.S. housing data, Greece talks concluding"," - May 24, 2016"
2647,DoubleLine's Gundlach says U.S. stock market is 'dead money'," - May 24, 2016"
2648,Banks and tech drive Wall Street up over 1 percent," - May 24, 2016"
2649,"U.S. stocks soar as homebuilder, tech sectors boost the major indices"," - May 24, 2016"
2650,U.S. stocks higher at close of trade; Dow Jones Industrial Average up 1.22%," - May 24, 2016"
2651,U.S. stocks gain after housing data; Dow jumps 200 points," - May 24, 2016"
2652,"U.S. new home sales soar in April, blowing through forecasts"," - May 24, 2016"
2653,Asian shares down as investors note likely Fed rate hike next month," - May 23, 2016"
2654,"U.S. stocks flat as Fed speak outweighs technology, materials rally "," - May 23, 2016"
2655,U.S. stocks lower at close of trade; Dow Jones Industrial Average down 0.05%," - May 23, 2016"
2656,"Apple, energy shares shine as Wall Street rallies"," - May 16, 2016"
2657,"U.S. stocks rise sharply amid surge in crude oil, Apple "," - May 16, 2016"
2658,U.S. stocks higher at close of trade; Dow Jones Industrial Average up 1.00%," - May 16, 2016"
2659,"Gold hits 1-week high amid weak U.S. manufacturing, Japanese PPI data"," - May 16, 2016"
2660,Investing.com sentiment index: speculators reduce bearish dollar bets," - May 16, 2016"
2661,"Shares in Asia gain with Tokyo up on weaker yen, Fed eyed"," - May 16, 2016"
2662,S&P seen failing in reach for year-old record," - May 13, 2016"
2663,Wall Street drops at end of tough week for retailers," - May 13, 2016"
2664,"U.S. stocks fall sharply as Financials, Consumer Staples weigh"," - May 13, 2016"
2665,U.S. stocks lower at close of trade; Dow Jones Industrial Average down 1.05%," - May 13, 2016"
2666,"U.S. stocks mixed in cautious trade, ahead of April jobs report"," - May 05, 2016"
2667,U.S. stocks mixed at close of trade; Dow Jones Industrial Average up 0.05%," - May 05, 2016"
2668,U.S. stocks gain despite employment data and ahead of Fed speakers," - May 05, 2016"
2669,"Asian shares with Tokyo shut, Sydney down after trade, retail data"," - May 05, 2016"
2670,"Gundlach warns on 'safe' stocks, Trump presidency"," - May 04, 2016"
2671,"U.S. stocks fall sharply amid weak jobs data, reports of Trump's GOP win"," - May 04, 2016"
